id;date;text;hashtags
1130825078336368640;2019-05-21;So you are confirming that Huawei phones will get updates to Android including new Android versions when released ? I thought that definitely wasn't the case ?? Security patches and nothing else was what was discussed.....;
1130825069452767232;2019-05-21;Here’s how MTN, Vodacom, Cell C, and Telkom could end up making (possibly rather a lot of) money out of Huawei’s Android crisis Business https://wp.me/paNJlt-1AX;
1130825001513496576;2019-05-21;Has 38 bill in cash.... // Huawei banned from Google Android after Trump administration cracks down - The Washington Post - https://www.washingtonpost.com/technology/2019/05/20/google-cuts-off-huawei-after-trump-administration-crackdown/ …;
1130824992441229313;2019-05-21;Huawei’s phone business would be decimated without Google’s Android #Android http://bit.ly/30pyBfg;#Huawei #Google #Android #USA #Chinahttps
1130824862782480384;2019-05-21;After U.S. officials gave a 90-day reprieve to Huawei, Google said Tuesday it will suspend a plan to quit providing its Android operating system to the Chinese smartphone maker. https://www.upi.com/Top_News/US/2019/05/21/Google-allows-Huawei-to-keep-using-Android-until-August/8991558436863/ … #USNews #USRCpic.twitter.com/rkuigu8p8W;
1130824851583688704;2019-05-21;Huawei To Consider Rivals To Google Android System;
1130824736462786560;2019-05-21;But doesn't huawei counts as an android?;
1130824698554531841;2019-05-21;BBC News - Huawei's Android loss: How it affects you https://www.bbc.co.uk/news/technology-48334739 …;
1130824692154155008;2019-05-21;Huawei blacklisted in USA and most of Europe. Rest of the world avoiding due to security risk and stoppage of android on these phones.;
1130824675867672576;2019-05-21;$GOOG $GOOGL HUAWEI TO CONSIDER RIVALS TO GOOGLE ANDROID SYSTEM https://www.stockme.info/newsitem/5ce3ee9a66a9893ce8cbfb1f?aid=999 …;
1130824647879090182;2019-05-21;On Monday, Google, the internet search and smartphone software monopoly, announced that it would block Huawei phones from accessing critical parts of the Android operating system, effectively ending Huawei's business outside China. https://www.wsws.org/en/articles/2019/05/21/pers-m21.html …;#huawai #Android
1130824613213155328;2019-05-21;@Huawei responds to @Android ban with service and #security guarantees, but its future is unclear – @TechCrunch https://tcrn.ch/2LTKUxe pic.twitter.com/AHtx5ZB1rm;
1130824419046305792;2019-05-21;Do you think @Google stance on severing ties with @Huawei is fair? #google #huawei #Android;#huawei #global #smartphone #online #android #shipments #consumer #china
1130824373844054016;2019-05-21;If you think Huawei can provide an OS that can replace Android then...;
1130824341745274881;2019-05-21;HUAWEI TO CONSIDER RIVALS TO GOOGLE ANDROID SYSTEM Yuandroid;#Huawei
1130824097775140865;2019-05-21;#Google and Android system start to cut ties with #Huawei - it will only be able to use the #opensource version of #Android Huawei buys about $67 billion worth of components each year, including about $11 billion from US suppliers #5G https://phys.org/news/2019-05-google-android-ties-huawei.html … via @physorg_com;#Huawei
1130824087889223680;2019-05-21;Bhai your damn right even Huawei should start providing bootloader unlockel codes again;
1130823988609863680;2019-05-21;Will Google Stop Releasing Android Updates For Huawei and Honor Phones? The Answer is Yes https://www.news18.com/news/tech/will-google-stop-releasing-android-updates-for-huawei-and-honor-phones-the-answer-is-yes-2147335.html …;
1130823910121807872;2019-05-21;Yes totally agreed with you bhai;
1130823873509961728;2019-05-21;Huawei Google Ban - EXPLAINED! #Huawei #Ban #Google #HuaweiForever #AndroidQ #Android #technology https://youtu.be/N5YxqTmjUZ0 pic.twitter.com/hj3EuxDKEY;
1130823824855818240;2019-05-21;Huawei and Honour phones are very risky to buy. Even after huge discounts these phones are extremely risky because android has withdrawn support. Also huge security risk in these phones;
1130823688461406208;2019-05-21;[Update: Now down to $540 and $270] B&H drops the Huawei P30 and P30 Lite prices to $570 and $280, respectively #Android pic.twitter.com/68E8W4QpJr;
1130823425189175298;2019-05-21;#HuaweiForever: seems like #USChinaTradeWar isn't going to stopAside from cutting off @intel & @Qualcomm supplies, @Google would give Huawei access only to #opensource version of #Android. For sure, blacklisting of @HuaweiMobile will affect #5G rollout.https://techcrunch.com/2019/05/20/several-chip-companies-including-qualcomm-and-intel-have-reportedly-stopped-supplying-huawei-after-blacklist/ …;
1130823266392653826;2019-05-21;Huawei will become open source software provider i guess in future and again start providing bootloader unlock codes if this shit continues;
1130823244087549952;2019-05-21;Huawei will continue developing an Android ecosystem that benefits users and the industry.;#Huawei #huaweiban
1130823218384777226;2019-05-21;In short term, trump is the idiot one and in long, still, trump is an idiot. It will not take long for huawei/china to bring in something in competition against android. Before this, android was the lone wolf.;#Huawei #HuaweiBan
1130823173287612416;2019-05-21;When there is #CyanogenMod and Samsung near to it's own OS. Time will tell who will benefit from Google pulls #Huawei Android license, forcing it to use open source version https://www.theverge.com/2019/5/19/18631558/google-huawei-android-suspension?utm_campaign=theverge&utm_content=entry&utm_medium=social&utm_source=twitter …;#phonenetworks #problems #02 #Huawei
1130823148423847936;2019-05-21;Yes android it’s open source but remember android it’s just a platform. Unlike Linux Meego which Tizen is built on. So likely Huawei will end up with Meego running Tizen, then the new world of free apps will come out of it.;
1130823142115545091;2019-05-21;Google Restricts Huawei’s Access to Android After Trump Order https://www.nytimes.com/2019/05/20/technology/google-huawei-android.html …;
1130823060360089600;2019-05-21;Google just dealt a huge blow to Huawei, reportedly cutting it off from Android updates It was only about two months ago that Richard Yu, the CEO of Huawei's consumer products division, was telling a German newspaper that the beleaguered Chinese smartphone brand had been pr…;#Echobox
1130823026558361602;2019-05-21;Google's Huawei Android restrictions: what does it mean for you? [Updated] | TechRadar https://www.techradar.com/news/googles-huawei-android-restrictions-heres-what-it-means-for-you …pic.twitter.com/Dek5unHtOb;#Huawei #Android
1130822983516401665;2019-05-21;Why Trump’s Huawei ban could cripple the company: Things just keep getting worse for Chinese tech giant Huawei. After Google revoked Huawei's Android license over the weekend, a handful of U.S. companies, including chipmakers Qualcomm and Broadcom and… http://feeds.mashable.com/~r/Mashable/~3/sPjR_ZPlMUg/?utm_source=dlvr.it&utm_medium=twitter …;
1130822744575238144;2019-05-21;Thank you for reaching out. We would like to inform you that the operating system of smart phones, Android has always been an open source, Huawei as an important participant has made a very important contribution to the development and growth of Android.;
1130822679542603779;2019-05-21;Even if the OS is terrible? Huawei chose Android for a reason.;
1130822603902529538;2019-05-21;Let me clear your misconception !! Huawei Samsung or whatever phone Power by Android all Authorized or Owned by Google. !! So technically you all are the same except me I build my own OS for my Phone;
1130822504484933633;2019-05-21;Here’s how MTN, Vodacom, Cell C, and Telkom could end up making (possibly rather a lot of) money out of Huawei’s Android crisis https://www.businessinsider.co.za/huawei-app-gallery-replacement-for-play-store-promises-operator-revenue-split-2019-5 …;
1130822475955232768;2019-05-21;HongMeng OS is Huawei's Alternative to Android (Rumor) https://www.cnx-software.com/2019/05/21/hongmeng-os-is-huaweis-alternative-to-android-rumor/ …;
1130822448545505280;2019-05-21;Huawei Responds to Android Ban with Service and Security Guarantees http://twib.in/l/EBkBogpdGEy5;#Google #Huawei
1130822365053673472;2019-05-21;huawei pr sb chly ga !! Lkn new phones me sirf Google services use nhi kr skta huawei ! Currently jo log use kr rhy h wo use kr skty hai ! Bus android version update nhi ho ga ab mazeed ! https://twitter.com/_eqrah_hun/status/1130805818180476929 …;#android #PureOS
1130822350054707200;2019-05-21;Well it’s meant to be Android but the recent Google news may change that;
1130822317074976768;2019-05-21;America is a dictatorial state They are the enemies of success did not observe the development and growth of China's economy and its superiority in technology Huawei banned from using Android should support Sony Huawei in good and bad;#futureofwork #innovation #growth #leadershippic
1130822276511883264;2019-05-21;Why Trump is banning huawei? A person captured a picture of him while changing from 500 meters away via huawei p30 pro, so trump took this action against the company... #Huawei #Android #Google #HuaweiForever;
1130822085931130881;2019-05-21;BB were close to going under so had no option than to get Android. I think Huawei will fine in the long term. How long does Trump have left??;#huaweiandroid
1130821932360884230;2019-05-21;Google allows Huawei to keep using #ANDROID until August http://gpwx.news/au7x2 #Tweet4Mee;
1130821881269968896;2019-05-21;In the future Huawei could be a competitor of Android, sure. But today, not even close.;#huawei #google
1130821856695652353;2019-05-21;Google puts Huawei Android suspension on hold - Business Insider;#Huawei #Android
1130821820771393536;2019-05-21;Google bans Huawei from accessing Android & its licensed apps (via @CSecurityAlerts #Cybersecurity News)http://go.newsfusion.com/security/item/1439454 …;
1130821811682209798;2019-05-21;Huawei Officially Responds To Android Ban http://www.ubergizmo.com/2019/05/huawei-responds-android-ban/?utm_campaign=trueAnthem%3A+Trending+Content&utm_content=5ce3ec1c72c13d0001ebac30&utm_medium=trueAnthem&utm_source=twitter …pic.twitter.com/53IviTTx0P;
1130821594287345664;2019-05-21;All the Best “Hongmeng” is @HuaweiCentral 's first ever self developed operating system #Huawei #Hongmeng #Android #Google hpic.twitter.com/T4CjxzoTrd;
1130821587496779776;2019-05-21;Seriously not a Big issue. Just Root your Android and change the Architecture of your device and then. Flash All Gapps done !!! . Google Realize the Device is Not Huawei;
1130821544186396681;2019-05-21;"I feared I'd not be allowed across borders with my old phone, replaced it this spring: ""On Sunday, Google suspended Huawei’s access to updates of its Android operating system & chipmakers cut off supplies to the company, after the US govt added it to a trade blacklist last week"" https://twitter.com/guardianworld/status/1130778017733550080 …";
1130821503023345670;2019-05-21;Google vs Huawei: Google stops Huawei from using Android Apps and Security Updates http://bit.ly/2JyspfF;
1130821429140840448;2019-05-21;#Google Cuts Off Huawei Phones from Future Android Updates https://www.cnet.com/news/google-reportedly-cuts-off-huawei-phones-from-future-android-updates/?utm_source=Legatus+Insider&utm_campaign=854ad383a6-EMAIL_CAMPAIGN_2018_11_12_08_51_COPY_02&utm_medium=email&utm_term=0_b4c5d7b538-854ad383a6-72717655 … #CRE #china #trade;
1130821302829355008;2019-05-21;Daily Nation ke - 'Plan B': Huawei's operating system headache after Android ban http://tinyurl.com/y3nyjv2q;#android #google #huawei #mobile #webpic
1130821268985356288;2019-05-21;Biggest mistake by USA after Trump has ordered Google to ban #HUAWEI from using its Android OS, those Chinese will develop one of the best operating systems, Wait for Huawei to come up with its own OS. USA shouldn't play with China https://twitter.com/TheEconomist/status/1130649337187491842 …;
1130821268633214976;2019-05-21;As Google denies Huawei access to the proprietary components of the Android mobile operating system, we have to ask a fundamental question: how dependent does the world want to make itself on proprietary software. https://www.faz.net/aktuell/wirtschaft/diginomics/lehre-aus-dem-fall-huawei-die-wiederentdeckung-der-freien-software-16198584.html …;
1130821121920704512;2019-05-21;Google allows Huawei to keep using Android until August http://bit.ly/30y5RB7;
1130821046226042880;2019-05-21;#Mobile : In this #Huawei vs #Google case, we have to learn (again) about monopolistic situations and the next move from Huawei could be interesting. Big deal to get back #Android ? Alternative OS like their own HongMeng OS or #SailfishOS ? #UbuntuTouch ?https://www.engadget.com/2019/05/19/google-pulls-android-support-from-huawei/ …;#mobile #Android #google #Huawei
1130820950310772737;2019-05-21;As Tech Altar explained (link to his video down). maybe this will be a new start to foreign phone makers to stop using Google services and doing their best to make Android more open than ever, idk. Let's see how it'll work out. (Yeah, and huawei cant use their services now);#Echobox
1130820933172826112;2019-05-21;What's going on with this Android ban on Huawei devices?;#Huawei
1130820857796816896;2019-05-21;#Huawei's #Android loss: How it affects you https://ttl.link/2ElZLKB #ITsupportpic.twitter.com/ltWthKbXSB;
1130820841728544775;2019-05-21;So we agree: Android *is* open source, & as an entirely distinct but related issue, the proprietary components built on top of Android have become a huge issue for #Huawei as a result of geopolitics.;
1130820589952872449;2019-05-21;As a colony of Chinese, it’s a fundamental right of every Pakistani to destroy their iPhones and replace with China ka huawei. Not sure if android will work on it but huawei kae camera sai app blackhole dekh saktay ho. https://www.facebook.com/story.php?story_fbid=10219233412569121&id=1323031501 …;
1130820557593821184;2019-05-21;Read my May 21 Newsletter featuring “Huawei's Android loss: How it affects you” https://nzzl.us/83djLXW;
1130820522005225472;2019-05-21;Huawei have a license to continue software updates until August 19.;#huawei #google #HuaweiForever #android
1130820475737858048;2019-05-21;Following the news over the weekend that #Google was halting the delivery of software and hardware to #Huawei for #Android things, several other companies have complied with US government rules, constricting supplies to Huawei.;
1130820404073902080;2019-05-21;Our timeline of the Huawei controversies continues with further US trade restrictions, leading Google to announce it might be forced to prevent Android from shipping on future handsets as well as limiting access to Google services such as YouTube and Maps. https://buff.ly/2BYJjih;
1130820399967739904;2019-05-21;But no updates on android!;#US
1130820083952037888;2019-05-21;I didn't say that Android was proprietary. My point was about the fact that most end-users don't care much about the underlying system and more about the services built on top of it( which are mostly not OSS). Hence the issue for Huawei.;
1130819995817140226;2019-05-21;I wish You All the Best to “ #Hongmeng” is @HuaweiCentral ’s first ever self developed operating system #Huawei #Hongmeng #Android #Google;
1130819799012073472;2019-05-21;#Huawei already have their own operating system ... called #EMUI ... and it is compatible with #Android They have their own version of #GooglePlay .... called #AppGallery ... and the apps are compatible with android. Both of these and #iOS and #Windows are produced by #Linux;
1130819788811505664;2019-05-21;I beg to differ. OS need apps, Huawei doesn't have an app store nearly as big as Google Play.;
1130819659240841216;2019-05-21;Thank you for your concern about Huawei. We would like to inform you that as the operating system of smart phones, Android has always been an open source, Huawei as an important participant has made a very important contribution to the development and growth of Android.;
1130819588680294400;2019-05-21;Google evades Huawei Android license with immediate effect http://bit.ly/2JOR13k May 21, 2019 at 02:06PM;
1130819544669310976;2019-05-21;Google evades Huawei Android license with immediate effect;
1130819439312678912;2019-05-21;Google evades Huawei Android license with immediate effect: According to a report of the… https://goo.gl/fb/e9S1mT;
1130819420878774272;2019-05-21;Google allows Huawei to keep using Android until August https://www.upi.com/Top_News/US/2019/05/21/Google-allows-Huawei-to-keep-using-Android-until-August/8991558436863/?utm_source=dlvr.it&utm_medium=twitter …;
1130819313265512450;2019-05-21;You don't seem to understand that this is because Huawei is based in China. Samsung won't get blocked because South Korea are allies with the US.;
1130819303937327104;2019-05-21;According to Google, Huawei and the American economy are the two knights and the winner is Samsung! The Android system is open source and Huawei is a key member in developing this system! pic.twitter.com/ud3VPneavi;
1130819263349043200;2019-05-21;Bukan US lift ban for 90 days ke? Time tu lah dia bagi peluang utk huawei bagi update security patch n so on. And they definitely not gonna get the next version of Android which is android Q;
1130818840173076481;2019-05-21;Android Q beta removal could spell trouble for Huawei Mate 20 Pro http://bit.ly/2w9wPkB;
1130818655246176257;2019-05-21;How Google's rift with Huawei could change Android and smartphones forever https://www.pcworld.com/article/3396190/google-huawei-android-apps-play-store-future.html?utm_source=dlvr.it&utm_medium=twitter#tk.rss_all …;#Huawei #Android #Huawei
1130818613731053568;2019-05-21;Huawei Mobile to Android We've our own jinish https://www.nst.com.my/world/2019/05/490291/huaweis-hongmeng-operating-system-gradually-replace-android …;#Android
1130818585742462977;2019-05-21;A rise in Samsung Shares while Huawei still struggles - #Huawei #Android pic.twitter.com/rXzAYa5PmE;#sakhti #google #googlememes #google #trump #huawei #jamerehna #donaldtrump #poor #mi #oppo #whoisnext #wtf #android #googleandroid
1130818523322695681;2019-05-21;Via rvp Ravi VS Prasad RT IoT_tt https://twitter.com/IoT_tt/status/1130805944580005888 … Manish Singh, Jon Russell: Huawei responds to Android ban with service and security guarantees, but its future is unclear https://buff.ly/2HEAImP #IoT Manish Singh, Jon Russell: Huawei responds to Android ban with servi…;#Huawei #Android #Australian #customers #microsoft #feedly
1130818382025117699;2019-05-21;#google #android Can Huawei make a phone without US parts? http://bit.ly/2JOQDlo;
1130818375540707329;2019-05-21;Don’t be like Huawei, dependant on others. Be like Apple, Be yourself. #huaweiban;
1130818340568621057;2019-05-21;Google halts plans to bar Huawei’s access to some Android services, report says Google halted plans to bar Huawei’s access to some Android services after the U.S. Commerce Department... https://www.foxbusiness.com/technology/google-halts-plans-huawei-ban-android-services-report …;#IraIosebashvili
1130818216471736320;2019-05-21;Will it be available on Huawei?;
1130817989270528000;2019-05-21;Google halts plans to bar Huawei’s access to some Android services, report says https://cryptocycle.wordpress.com/2019/05/21/google-halts-plans-to-bar-huaweis-access-to-some-android-services-report-says/ …pic.twitter.com/361H39UG81;#saas #sales #tech #martech
1130817758520860672;2019-05-21;After the drama over the beauty community, now its the tech industry. Whats goin on with the world? #jamescharles #jeffreestar #tatiwestbrook #Huawei #android #Google;
1130817745279475713;2019-05-21;"""Google halts plans to bar Huawei’s access to some Android services, report says"" via FOX BIZ https://fxn.ws/2w9yLtv";#HuaweiBan #Africa #Huawei #4G #Huawei
1130817523224666114;2019-05-21;Manish Singh, Jon Russell: Huawei responds to Android ban with service and security guarantees, but its future is unclear https://buff.ly/2HEAImP #IoT;#Huawei #Android_ban
1130817389510053890;2019-05-21;"""Google halts plans to bar Huawei’s access to some Android services, report says"" via FOX BIZ https://fxn.ws/2w9yLtv pic.twitter.com/c0cJldjk1T";
1130817293481644034;2019-05-21;"""Google halts plans to bar Huawei’s access to some Android services, report says"" via FOX BIZ https://fxn.ws/2w9yLtv #tech #technology #news";#BeSmart #GeekOn #gadget #tech
1130817251026751489;2019-05-21;"""Google halts plans to bar Huawei’s access to some Android services, report says"" via FOX BIZ https://fxn.ws/2w9yLtv pic.twitter.com/CSil2j9WRW";#HuaweiP30 #HuaweiForever #Huawei #Huaweiuser #P30Pro #P30 #android #techhouse #technology #techniekpact #techEasyLazy #techpic
1130817208697757698;2019-05-21;So you banned a company that is a fortune 500 and internationally, sell their phones with a software that's built with Google USA. How are people living outside going to use Huawei's?We all suffer cause of one decision by one country;
1130817156520775680;2019-05-21;Here’s how MTN, Vodacom, Cell C, and Telkom could end up making (possibly rather a lot of) money out of Huawei’s Android crisis https://goto.bi/HuaweiApp pic.twitter.com/TCMQB2Ogcn;
1130816999062478848;2019-05-21;@Google did I read wrongly? I m not an android user, but I m disappointed with the decision made by @Google . Very disappointing the way they handle their valued customer @Huawei;
1130816985221206018;2019-05-21;To all future huawei users/ nagbabalak mag huawei ang phone: Android and google banned huawei, and may balak na gumawa ang huawei ng sarili nyang OS. Which makes it medyo unreliable for the mean time. It will be inconvenient for you. Means no playstore, youtube etc.;
1130816819521101825;2019-05-21;Wht abt Google and android withdrawing their support for Huawei;#Echobox
1130816562183770113;2019-05-21;Huawei has announced that they will soon introduce a diffrent OS or might be using Android on Open source;
1130816408974053376;2019-05-21;. @Huawei cut off from @Google's @Android http://ow.ly/Jwip50ujic7;
1130816359657549824;2019-05-21;Daily Crunch: Huawei faces Android ban - http://ow.ly/Ekl930oMvDb via @trendspottr #Infosec #CyberProtect #CyberSecurity;#Honor20 #HONOR20Series #mobilemarketingpic
1130816356893564933;2019-05-21;Google offers Huawei a brief reprieve by putting its Android suspension on hold https://www.businessinsider.com/google-puts-huawei-android-suspension-on-hold-2019-5 …;
1130816347477291008;2019-05-21;Also, the current customers of #Huawei won't b affected as #Google will still support them. #android #technology;#TechMuzz
1130816311477641217;2019-05-21;Google is cutting Huawei's access to Android. Here's what it means: http://on.forbes.com/6016EYciQ pic.twitter.com/aJvazcALTy;
1130816289784700928;2019-05-21;Google is planning on pulling Huawei's access to Android's core accounts. This means that the Chinese brand faces restrictions on using basic apps such as Gmail, Google Search, Google Maps, Chrome, and Google Play Store. https://www.ecr.co.za/shows/east-coast-breakfast/tech-expert-shares-his-insights-into-huaweis-latest-debacle/ …pic.twitter.com/UDJ25E6L3t;
1130816198877298688;2019-05-21;Google blocks Huawei access to Android updates https://teoptek.blogspot.com/2019/05/google-blocks-huawei-access-to-android.html#.XOPnFZ8ueYI.twitter … #huawei #HuaweiP10 #huaweip9 #huaweip10plus #huaweiphotography #SMARTPHONE #smartphones #smartphonephotography #smartphonecase #phones #PhoneCases #GOOGLE #ANDROID;#threatintelligence #google #Huawei #Android #app #cybersec #cybersecurity #threatintel #security #cybercrime #cybercriminals #hackers #cyberespionage #databreaches #PIIhttps
1130816105809760256;2019-05-21;Google offers Huawei a brief reprieve by putting its Android suspension on hold https://buff.ly/30y0fqB;#Huawei #HuaweiBan
1130816086121832449;2019-05-21;Google puts Huawei Android suspension on hold - Business Insider https://www.businessinsider.com/google-puts-huawei-android-suspension-on-hold-2019-5?nr_email_referer=1&utm_source=Sailthru&utm_medium=email&utm_content=Opening_bell&utm_campaign=Post%20Blast%20%28moneygame%29:%2010%20things%20you%20need%20to%20know%20before%20the%20opening%20bell&utm_term=10%20THINGS%20BEFORE%20THE%20OPENING%20BELL%20-%20ENGAGED%2C%20ACTIVE%2C%20PASSIVE%2C%20DISENGAGED …;
1130816041142116352;2019-05-21;All those who are saying, #Huawei smartphones will be dead, calm your titties! They've been working on their own OS #HongMeng since 2012 and releasing now. The thing is, time will tell whether it'll boost up or kill Huawei (outside China!) #Technology #Android #Ban;
1130815897877254144;2019-05-21;> New video regarding Huawei's recent allegation. https://youtu.be/qSL8Rt8RO90 Do check it out. #huawei #huaweiban #androidban;#huawei #android
1130815872103342081;2019-05-21;To abide law, Google could just stop doing biz w/ Huawei. However, they took it further & made their own decision to ban the access of google services for Huawei users. Don’t be evil? Just a joke. They must pay for it. Good opportunity for ISVs outside the US to dev replacements;
1130815533949919232;2019-05-21;Or not use Android at all, then I might switch to Huawei. Trump is forcing what I have wished for a while, a new source of innovation. Albeit it's from China, i have no trade secrets to be stolen from.;#tech #ITRTG
1130815487045251072;2019-05-21;I'm only on Android phone, but it's a Huawei so I might be in all kinds of trouble.;
