id;date;text;hashtags
1130865994866601984;2019-05-21;Is the trade war escalation aiming at killing Google rather than Huawei? We know Google has strong Agency tie. Trump Must know such ban will push Huawei drop Android platform even if the ban is lifted. How much impact will it has on Android?;
1130865973035261952;2019-05-21;Google di3 dem fool Ebe playstore and Android u go take rush Huawei... today they might win but later ego over them foolish google;
1130865911718653952;2019-05-21;Will the google ban really affect huawei users as much?! I’m actually a large android user. Too much limitation on the iPhone honestly;
1130865875991572481;2019-05-21;Huawei may debut its Android alternative as soon as this fall https://ct3ch.net/huawei-may-debut-its-android-alternative-as-soon-as-this-fall/ …pic.twitter.com/V7xBlXZEuO;
1130865853098934272;2019-05-21;Huawei's Android replacement to arrive this fall with big app catalog http://dlvr.it/R57jcC @slidemepic.twitter.com/lFzn5PwurE;#BLACKPINK #Android #IOS
1130865841275318273;2019-05-21;Huawei may debut its Android alternative as soon as this fall https://ct3ch.net/huawei-may-debut-its-android-alternative-as-soon-as-this-fall/ …pic.twitter.com/z0XCDB0mQf;#referrer
1130865812678402048;2019-05-21;Huawei is reportedly ramping up its app store efforts in what could be another sign it was prepared for a breakup with Google’s Android http://bit.ly/2HHoWbC johnangel1977;
1130865745070444545;2019-05-21;Huawei's Android replacement to arrive this fall with big app catalog - http://www.phonearena.com/news/Huawei-Android-replacement-release-date-features_id116204 …;
1130865722651922434;2019-05-21;How #Google's #Huawei license ban could change #Android and smartphones forever | PCWorld http://bit.ly/2Hyfokp;
1130865718231216130;2019-05-21;The operating system that prepares Huawei is compatible with Android apps #Huawei #HuaweiOS #Android https://www.gizchina.com/2019/05/21/the-operating-system-that-prepares-huawei-is-compatible-with-android-apps/ …pic.twitter.com/WlQM6ycm6c;
1130865700904423425;2019-05-21;Huawei is reportedly ramping up its app store efforts in what could be another sign it was prepared for a breakup with Google’s Android http://bit.ly/2HHoWbC;#ftag
1130865671372451840;2019-05-21;Huawei is reportedly ramping up its app store efforts in what could be another sign it was prepared for a breakup with Google’s Android http://bit.ly/2LWIJsM;
1130865665395580928;2019-05-21;'Plan B': Huawei's operating system headache after Android ban - https://www.greeen.info/?p=750543 pic.twitter.com/Kl97Lcf1Om;
1130865645837541376;2019-05-21;Huawei may debut its Android alternative as soon as this fall https://www.15minutenews.com/article/165347949/huawei-may-debut-its-android-alternative-as-soon-as-this-fall/ … #Gadgets;
1130865633871245312;2019-05-21;Huawei is working on a backup OS that natively runs Android apps https://www.avnblogfeed.com/mobile-phone-news/huawei-is-working-on-a-backup-os-that-natively-runs-android-apps/ …pic.twitter.com/YT0GqJERGP;
1130865620231307264;2019-05-21;10 Things To Know. Huawei is reportedly ramping up its app store efforts in what could be another sign it was prepared for a breakup with Google’s Android http://bit.ly/2HHoWbC;
1130865612861919236;2019-05-21;@OnePlus_IN @oneplus Hi, regarding the latest ban from US on #Huawei phones. How safe it will be to put money on one plus7. How do you guarantee that these restrictions won't be imposed on you in future. Initially I was thinking to buy one. But, confused now. #huaweiban;
1130865593979215873;2019-05-21;"#engadget: ""Huawei may debut its Android alternative as soon as this fall https://www.engadget.com/2019/05/21/huawei-operating-system-available-fall/ … pic.twitter.com/kgWqJTyCfN"" #tech $tech #technology #technews #news $news #technologynews";
1130865506075009026;2019-05-21;Huawei's Android loss: How it affects you https://www.bbc.co.uk/news/technology-48334739 …;
1130865418942459904;2019-05-21;Huawei may debut its Android alternative as soon as this fall https://www.engadget.com/2019/05/21/huawei-operating-system-available-fall/ … pic.twitter.com/bhLZmppQDP;
1130865418787205122;2019-05-21;Even if the decision is overturned, I still think they should develop and release their own OS (likely an Android fork), if anyone can do it, it's Huawei.;#Huawei #mobileOS #Android #Huawei
1130865417197707265;2019-05-21;@HuaweiMobileUK @Huawei_Europe Now that android isn't an option anymore, could you pls allow us to get OUR bootloader unlock code ?!;
1130865397459226625;2019-05-21;Our future world will be pretty f****d up !!! US just set a trend with this trade war & Huawei episode and i m sure chinese will bring them on their knees when it will be their turn !! #huaweiban #tradewar;#news #technology
1130865384205246468;2019-05-21;Huawei is reportedly ramping up its app store efforts in what could be another sign it was prepared for a breakup with Google’s Android http://feedproxy.google.com/~r/typepad/alleyinsider/silicon_alley_insider/~3/w0tWp5QA8GQ/huawei-ramps-up-app-store-efforts-as-google-android-breakup-nears-2019-5 …;
1130865373644038144;2019-05-21;Huawei Loses Access to Android Updates Amid US, China Trade Dispute (Updated) https://newsychronicles.com/2019/05/20/huawei-loses-access-to-android-updates-amid-us-china-trade-dispute-updated/ …;
1130865367692267521;2019-05-21;Eve If Donald Trump Could Stick To His Policies Or Whatever It Maybe The Case We Are #Huawei Customers, We Know That This Too Shall Pass. #TradeWars #Huawei #Huaweiban #Huawei #HuaweiForever #HuaweiForever;
1130865349723918341;2019-05-21;Yes true and it knows that. The words are just reassuring but the impact on its new products would have a devastating effect on its products. Cameras are produced by Leica a Germany/US firm, softwares by US firms e.t.c Huawei version will take years to take Android, Windows;
1130865308540002307;2019-05-21;Huawei may debut its Android alternative as soon as this fall #mobil https://www.engadget.com/2019/05/21/huawei-operating-system-available-fall/ …;#Huawei #huaweiban #Google
1130865235924066309;2019-05-21;Huawei is reportedly ramping up its app store efforts in what could be another sign it was prepared for a breakup with Google’s Android http://dlvr.it/R57hJ4;
1130865224913956865;2019-05-21;NO, that won't be that easy. For the world outside of China, even a nearly identical Android without actual Google Apps would be a dealbreaker. Even if there are alternative to each and every Google app, the fluid compatibility with each other would be a real problem for Huawei.;
1130865209877254145;2019-05-21;Huawei may debut its Android alternative as soon as this fall https://www.engadget.com/2019/05/21/huawei-operating-system-available-fall/ …pic.twitter.com/JTQwBclzSY;
1130865165426151424;2019-05-21;Google banned Huawei for Android Os now huawei is launching there own os called as Hongmeng os Huawei walo stay calm;
1130865097503432704;2019-05-21;New post: Huawei is working on a backup OS that natively runs Android apps https://wp.me/p1NyTi-fCY;
1130865020290719744;2019-05-21;Dear Huawei and Honor sub-brand: You are fucked. #Google #Android;
1130864969904402432;2019-05-21;Huawei is reportedly ramping up its app store efforts in what could be another sign it was prepared for a breakup with Google’s Android http://dlvr.it/R57gv5 #tech #onlinebusinesspic.twitter.com/jrDiFUzT3M;#capitalexits #acquisitions #mbopic
1130864922487926793;2019-05-21;Thanks....the current situation is a nightmare for the end user. I have happily used Huawei handsets for the last few years however it is very disappointing that there will be no upgrade to the next version of Android.;
1130864887398313988;2019-05-21;"@Google suspends @Huawei from using Android on their phones. The head of Huawei says ""US is underestimating us"". GOOGLE just created a monster of a competition when they didn't have any. Koreans, Japanese and Chinese azinantanga when it comes to technology. Trump u moron";#TechNews
1130864865143341057;2019-05-21;Just because of its 5G trials, huawei is now going to face android restrictions from Google;
1130864800681078784;2019-05-21;@Android just bought a p30 pro far better then samsung! whats going to happen with future updates? If you drop huawei i'll drop android completely.;
1130864624008491008;2019-05-21;Huawei would prefer using Android & Microsoft but they have developed their own software, this is such an opportunity for countries to develop operating software that is country focused, and getting a gadget from whomever. I think this would also make gadgets more affordable. pic.twitter.com/n5iSFD3YU8;
1130864539279478784;2019-05-21;You’re telling Huawei has invested in their own independent OS by copying android?, tell me one thing China hasn’t copied yet.;
1130864533369704452;2019-05-21;Huawei may debut its Android alternative as soon as this fall https://engt.co/2w9IrnE #metabloks;
1130864353421516801;2019-05-21;Huawei’s replacement for Android reportedly called HongMeng OS pic.twitter.com/SPkFWQV1qm;
1130864234055839745;2019-05-21;RT businessinsider: Huawei is reportedly ramping up its app store efforts in what could be another sign it was prepared for a breakup with Google’s Android http://www.businessinsider.com/huawei-ramps-up-app-store-efforts-as-google-android-breakup-nears-2019-5 …;
1130864200404705280;2019-05-21;But in China,Huawei‘s fan is rare;
1130863966438154241;2019-05-21;#Google Cuts #Huawei Off from #Android Updates, #PlayStore, #Gmail and More after U.S. #government recently added Chinese company Huawei to its trade #blacklist, resulting in restricted access to American companies.https://www.iphoneincanada.ca/news/google-cuts-huawei-android/?utm_source=feedburner&utm_medium=feed&utm_campaign=Feed%3A+iphoneincanada+%28iPhone+in+Canada+-+Canada%27s+%231+iPhone+Resource%29 …;
1130863820040155136;2019-05-21;What's happening to Huawei shows how dominant Google's Android is. It also shows that the market isn't diverse at all. I suspect other phone makers, especially non American companies like LG, Samsung and Xiaomi are looking at this and thinking diversity must happen.;
1130863763400339462;2019-05-21;Huawei's Android loss: How it affects you By Leo Kelion Technology desk editor 20 May 2019 Technology Share this with Email Share this with Facebook Share this with Twitter Share this with Whatsapp Image... https://www.facebook.com/100004348577098/posts/1258242957663978/ …;
1130863743406170115;2019-05-21;"New post from Engadget RSS Feed: ""Huawei may debut its Android alternative as soon as this fall"" https://engt.co/2w9IrnE";
1130863694190133249;2019-05-21;"Huawei gets 90-day relaxation from Android ban, company to focus on its own OS https://ghanaguardian.com/huawei-gets-90-day-relaxation-from-android-ban-company-to-focus-on-its-own-os?utm_source=twitter&utm_medium=twitter_autopost&utm_campaign=twitter-post&utm_content=latest-posts …""";
1130863589592633344;2019-05-21;It's not such an easy fix. But, Huawei could succeed where Symbian etc failed as they have complete control on a 1B people market. What the ban did is awaken phone makers to the possibility of a sudden cutoff from Android. firms will try own OS in upcoming phones, esp cheap ones;
1130863568939708417;2019-05-21;Horon 2:0 Huawei Android phone launch defies Donald Trump https://www.theguardian.com/technology/2019/may/21/honor-20-launch-huawei-quad-camera-phone?CMP=twt_gu&utm_medium=&utm_source=Twitter#Echobox=1558451465 …;
1130863480385335296;2019-05-21;Honor 20: Huawei Android phone launch defies Donald Trump https://www.theguardian.com/technology/2019/may/21/honor-20-launch-huawei-quad-camera-phone?CMP=twt_gu&utm_medium=&utm_source=Twitter#Echobox=1558451465 …;
1130863424202825728;2019-05-21;Huawei users in SA told not to panic over Android ban http://www.capetalk.co.za/articles/349066/huawei-users-in-sa-told-not-to-panic-over-android-ban … via @CapeTalk;#agizaonline #huawei #android #Kenyapic
1130863253582622720;2019-05-21;Huawei’s Android alternative is coming this fall with Android app compatibility – XDA Developers https://itnewsrwanda.co.rw/huaweis-android-alternative-is-coming-this-fall-with-android-app-compatibility-xda-developers/ …;
1130863213946425344;2019-05-21;Huawei’s Android alternative may be coming this Fall with Android app compatibility - https://www.makersofandroid.com/huaweis-android-alternative-may-be-coming-this-fall-with-android-app-compatibility/ …;#TechNews #TechTipspic
1130863186801037313;2019-05-21;Huawei is working on a backup OS that natively runs Android apps http://bit.ly/30yC8Il;#Losing #Access
1130863100209426433;2019-05-21;Huawei responds to Android ban. #Telecoms;#Google #Android #Huawei
1130863089858023425;2019-05-21;The momentous news that Google is cutting off its Android relationship with Huawei in response to a US government ban on the Chinese giant wasn’t much of a surprise to Huawei. A fresh report from Bloomberg today... https://www.facebook.com/100003339170064/posts/2275754852545798/ …;
1130863052641980418;2019-05-21;@Huawei its an opportunity for u and #CHINA to develop there own mobile software to compete android.;
1130863031129448448;2019-05-21;I am a huawei user, I want google to ensure customer benefits not only for me but also for your other customers. Thank you !!!;
1130862956059799552;2019-05-21;Huawei CBG Chief Richard Yu reportedly says there will be a new OS as an alternative to Google Android for it's phones available in autumn at the earliest https://winfuture.de/news,109054.html …;
1130862881573167104;2019-05-21;Random android update on my huawei??? Hopefully not converting to Hongmeng;
1130862834772918272;2019-05-21;Now there would be another software just like android and IOS. Huawei would create their own;
1130862798551113729;2019-05-21;Huawei may debut its Android alternative as soon as this fall https://engt.co/2w9IrnE #tech;
1130862777839554560;2019-05-21;Huawei may debut its Android alternative as soon as this fall …https://noticiasdedeportes595817580.wordpress.com/2019/05/21/huawei-may-debut-its-android-alternative-as-soon-as-this-fall/ …pic.twitter.com/vtrQnXmC8t;
1130862622855901184;2019-05-21;@Huawei @HuaweiMobile resume bootloader unlock service now because you are banned by google and will not receive any android os update,so we can install custom OS,;
1130862424943468544;2019-05-21;Hundreds of millions of smartphone users will be affected by Google's decision to sever its Android operating system ties with Chinese handset maker Huawei https://theglobepost.com/2019/05/21/google-huawei-android/ …;
1130862367158427648;2019-05-21;Yu Chengdong: Huawei's unified operating system will be available later this fall or early next year on phones,computers,tablets,TVs,cars & wearables and is also compatible with all Android & web apps and if the Android app is recompiled,the system performance increases by > 60%. pic.twitter.com/NrB3FTqkYk;
1130862262686814208;2019-05-21;Honor 20: Huawei Android phone launch defies Donald Trump Buy one. NOW.;
1130862039532892160;2019-05-21;I don't need to pay attention, I will not buy #huawei #honor phones. Can you confirm that we will get #Google play store and security updates ? #Huawei #Honor are banned officially, no need to waste money on any of your products. #Honor20Pro is waste no mention of android.;
1130861959426072576;2019-05-21;Google’s Android ban for Huawei proves we need strong alternatives - by Rahmi Osman Kaçmaz @Kacmaz | DS Opinionhttp://sabahdai.ly/cr4a4l;
1130861817356607488;2019-05-21;Huawei may debut its Android alternative as soon as this fall https://simplenews.co.uk/politics/huawei-may-debut-its-android-alternative-as-soon-as-this-fall/ …pic.twitter.com/YBJBct3NyL;
1130861676603985920;2019-05-21;If I was @HuaweiMobileUK @HuaweiMobile I'd update all devices to Android pie by the end of the week and the stick two fingers up at America #Huawei #HuaweiForever;#Huawei #HuaweiBan #huaweiandroid
1130861607720849408;2019-05-21;Huawei may debut its Android alternative as soon as this fall http://j.mp/2EodJeY;
1130861570144313344;2019-05-21;Huawei may debut its Android alternative as soon as this fall https://engt.co/2VU7g6c #engadget #tomgadget;
1130861503727452163;2019-05-21;Google has revoked android license to Huawei yesterday and today Huawei was scheduled to launch its new product Honor 20.;#Huawei #Android #Huawei #huaweigoogleban
1130861442918363136;2019-05-21;Google, Android cut Huawei ties http://q8dailynews.com/story-z6699324;
1130861435007983616;2019-05-21;Google restricts Huawei from using Android.... Because Google wants all the spying and data collection for itself!;#news #Huawei #google #android
1130861295106793473;2019-05-21;YOU CAN'T KEEP CHINA DOWN, TRUMP! HUAWEI REVEALS ITS OWN 'HONGMENG' OPERATING SYSTEM TO REPLACE GOOGLE'S ANDROID AFTER WASHINGTON BANS 'SALE OR TRANSFER OF AMERICAN TECHNOLOGY' TO CHINESE PHONE GIANT https://www.malaysia-chronicle.com/?p=165216;
1130861284277116928;2019-05-21;What the Huawei Android ban means for Huawei smartphone owners: http://on.forbes.com/6011EcFqV pic.twitter.com/ESPPIlY98y;
1130861138814619648;2019-05-21;#News #Android #Android43 Huawei Android ban, explained: Could we see a Mate 30 without Google? http://dlvr.it/R57flq pic.twitter.com/iz2g6Ngeiw;#Huawei #huaweiban #huaweigoogleban
1130861102873505792;2019-05-21;Honor 20 Pro Smartphone has First f/1.4 Lens on Top of its 48MP Rear Camera .. . . . . #honor20pro #honor20Family #honor20 #honor20lite #supermacro #quadruplecamera #triplecamera #48mp #sonyimx586 #f14 #bokeh #kirin980 #huawei #honor #hihonor #android9 #kirin #google #android pic.twitter.com/SDrTrK0XPI;
1130861073811136512;2019-05-21;Huawei’s own OS is coming in Fall, features Android app compatibility https://www.gizmochina.com/2019/05/21/huaweis-own-os-is-coming-in-fall-features-android-app-compatibility/ … #Huawei #Android #google;
1130860954760175618;2019-05-21;Huawei is undeniably more popular than Apple now. And they're getting more sales than Samsung already. So it's very inevitable and not surprising if Huawei's able to create a better OS than Android and iOS. I'm just being hopeful and optimistic. Disappointments may come later.;
1130860669623001088;2019-05-21;Huawei may debut its Android alternative as soon as this fall https://engt.co/2M1qzpN pic.twitter.com/EyEKbyi4cg;
1130860655957794817;2019-05-21;Of phone selfies taken LIVE on my #Business breakfast show today on @KUTVKenya. One of Huawei Android, another of Apple iOS. #KUTVRiseToday #BiasharaTuesdaypic.twitter.com/n8odYpPOzr;#Huawei #ios #Android #technology
1130860646390743045;2019-05-21;Google has revoked Huawei's Android license - The Latest News https://www.xda-developers.com/google-revoke-huawei-android-ban-blacklist/ …;
1130860637473660928;2019-05-21;Huawei may debut its Android alternative as soon as this fall http://bit.ly/2QgMNCL https://engt.co/2w9IrnE;
1130860610487431168;2019-05-21;Huawei may debut its Android alternative as soon as this fall http://twib.in/l/RE7LRo4q5b9n via @ric9871ric #retweet #pleaseretweetpic.twitter.com/ALSHYy7Eig;#AskGuruji
1130860568410116096;2019-05-21;As the tech cold war seems to be kicking in (fuelled by trade interests), China and Huawei hedges with an own smartphone operating system #HongmengOS phasing out Google services on Android: https://sea.mashable.com/tech/3892/huawei-is-developing-its-own-mobile-operating-system-called-hongmeng-os …;#Huawei #HuaweiBan #huaweiandroid #HuaweiForeverpic
1130860375010873344;2019-05-21;Honor 20: Huawei Android phone launch defies Donald Trump https://one-dollar-hosting.com/honor-20-huawei-android-phone-launch-defies-donald-trump/ …;
1130860356845203457;2019-05-21;Google offers Huawei a brief reprieve by putting its Android suspension on hold https://www.businessinsider.com/google-puts-huawei-android-suspension-on-hold-2019-5?utm_source=twitter&utm_medium=referral&utm_content=topbar&utm_term=desktop&referrer=twitter … via @businessinsider;
1130860193724583936;2019-05-21;#android #aosp Huawei may debut its Android alternative as soon as this fall http://dlvr.it/R57fLJ pic.twitter.com/NFS0WxgQuV;
1130860121154826240;2019-05-21;Huawei may debut its Android alternative as soon as this fall http://dlvr.it/R57fLT pic.twitter.com/FfYxv2qXru;
1130860035616124928;2019-05-21;No it won't make a difference to them. Android and iOS hold 99% market share and Huawei can come no close to Android's performance. Why will developers develop apps specifically for Huawei? They don't really need to... android will still be the majority market holder.;#OS #Huawei #HuaweiBan #Technology #HuaweiGoogleBan
1130860014678171651;2019-05-21;Honor 20: Huawei Android phone launch defies Donald Trump https://www.theguardian.com/technology/2019/may/21/honor-20-launch-huawei-quad-camera-phone?CMP=share_btn_tw …;#Huawei #Android #HongMengOS
1130859891650809856;2019-05-21;Huawei may debut its Android alternative as soon as this fall https://www.engadget.com/2019/05/21/huawei-operating-system-available-fall/ … #operatingsystem #richardyu #business #internet #trade;
1130859854623416321;2019-05-21;US has lifted Huawei’s ban for three months - #huaweiban #Huawei https://powertech8.blogspot.com/2019/05/us-has-lifted-ban-from-huawei-till.html …;
1130859833131880448;2019-05-21;Huawei may debut its Android alternative as soon as this fall http://bit.ly/2LZGjcM pic.twitter.com/6o7XNpMzyT;
1130859755235209218;2019-05-21;Huawei may debut its Android alternative as soon as this fall http://dlvr.it/R57f3f;
1130859704962428928;2019-05-21;Huawei Smartphones Will Lose Google Android Software And Services, Reports Claim http://www.forbes.com/sites/zakdoffman/2019/05/19/huawei-smartphones-to-lose-access-to-google-android-software-and-services-reports-claim/?utm_source=FACEBOOK&utm_medium=social&utm_term=Valerie/#76616c657269 …;
1130859692060659712;2019-05-21;Huawei’s Android alternative may be coming this Fall with Android app compatibility https://www.xda-developers.com/huawei-android-alternative-fall-2019/ … via @xdadevelopers;
1130859684657795073;2019-05-21;#Huawei's Android loss: How it affects you https://www.bbc.co.uk/news/technology-48334739 …;
1130859589199650816;2019-05-21;With Huawei's Android license being revoked by Google, is it a right choice for consumers to buy a Honor phone since it's falls under Huawei brand ?;
1130859550226178053;2019-05-21;"""What the Huawei Android ban means for Huawei smartphone owners: http://on.forbes.com/6011EcFqV pic.twitter.com/qCjbWw80Kp""";
1130859539413262336;2019-05-21;Huawei's overconfidence will make it follow BlackBerry RIM,let's hope the new Os beats android;#Google #Huawei #Android
1130859521360875520;2019-05-21;Major components and software Huawei imports from the US for its smartphones: - Gorilla Glass (Corning) - Flash Storage (Micron) - Android (Google) - Radio-frequency chips for 4G (Qorvo & Skyworks) - 4G/5G chips, CPUs and GPUs (Qualcomm & Intel);#Huawei #HuaweiOS #Android
1130859346139725825;2019-05-21;Banning #Google apps and play store on #HUAWEI will be the biggest mistake of Google...! China will destroy Google now..! Mark my words #China #Android #Apple;
1130859339860758530;2019-05-21;What the Huawei Android ban means for Huawei smartphone owners: http://on.forbes.com/6011EcFqV pic.twitter.com/9ssN3Vcnv8;
1130859330096521217;2019-05-21;Honor 20: Huawei Android phone launch defies Donald Trump - The Guardian https://europeunion.press/?p=220235;
1130859048302129152;2019-05-21;Despite Huawei's US ban, the Honor 20 Pro launches with four rear cameras and, yes, Android https://www.cnet.com/news/honor-20-pro-packs-four-rear-cameras-and-an-affordable-price/ … Hands-on by @Batteryhq @cnet;
1130859028681302016;2019-05-21;Google and Android system start to cut ties with Huawei https://www.yahoo.com/news/google-android-system-start-cut-ties-huawei-071836682.html?soc_src=strm&soc_trk=tw … via @YahooNews;
1130858917641064453;2019-05-21;Google has suspended Huawei's Android license. Huawei reminds me of you @HillsEve. You badly wanted this phone years back. The good days.https://twitter.com/BakeKenya/status/1130729939882274817 …;#Gadgets
1130858911777603584;2019-05-21;Which makes me excited about having a device that has a different OS. And it'll be different from iOS. It's pretty much exciting but frightening because what if Android's still better? You better not disappoint us,Huawei.;
1130858899358257152;2019-05-21;$GOOGL Huawei Considers Rivals to Google's Android After U.S. Ban via http://www.hvper.com/?ref=s;
1130858891107897344;2019-05-21;Huawei is working on a backup OS that natively runs Android apps #TechMuzz http://bit.ly/2LM7dop http://bit.ly/2JSZbYw pic.twitter.com/k54ty4B2Zf;#Huawei #huaweiban
1130858852923187200;2019-05-21;Google’s Android ban for Huawei proves we need strong alternatives http://bit.ly/2HLLSqd;#engadget #tech #technology #technews #news #technologynews
1130858829929799680;2019-05-21;@Huawei Please consider using Ubuntu Touch instead of android;
1130858702011953153;2019-05-21;US Delays Huawei Ban, Company Gets Android Back For 90 Days: What Next? https://trak.in/?p=89213;
1130858660010156033;2019-05-21;I read it is more efficient... Which should not be hard, because Huawei has Symbian, Android and iOS as templates and can use the best of all worlds... And when Kirin processors come with their own OS at 1/4 the price of Qualcomm, which phone manuf. will still want Qualcomm? https://twitter.com/IsaacAs71437829/status/1130849305139408897 …;
