id;date;text;hashtags
1130908618293952513;2019-05-21;There is nothing such serious in it, The only issue is Google Play store, Gmail app (not gmail as email via other email client software) and youtube app (not via browser), huawei can use Android always as it is Open Source O.S, only google apps will not be available via playstore;
1130908486211166209;2019-05-21;Holochain has partnered with Huawei. Due to its ban in the U.S.A & google with android restrictions. It will be replacing andriod with holochain the only system capable of running a new dapp system. Huawei will run 5G uk #Holochain #bitcoin #ethereum #ripple #xrp #hot #btc #eth;
1130908469299691522;2019-05-21;#Europe: Can Huawei smartphones still run with Android? http://watsupeurope.com/news/can-huawei-smartphones-still-run-with-android/ …;
1130908466661531649;2019-05-21;Google Restricts Huawei's Access To Android Operating System - https://is.gd/5yy39Z #infosec #cybersecuritypic.twitter.com/6BTx30d5jK;
1130908445991940098;2019-05-21;My next android phone will be Huawei.;
1130908424085147648;2019-05-21;Reposted from @TheCyberSecHub - Google cuts ties with Huawei! Google’s move to stop licensing its Android mobile operating system to Huawei could deal a huge blow to the Chinese tech giant’s ambitions to become… https://www.instagram.com/p/BxvCVSin2ZP/?igshid=enewm9n28l0e …;
1130908421706997762;2019-05-21;Does Huawei's Android ban give Sony Xperia a fighting chance? | Xperia Blog #Sony #Huawei http://www.xperiablog.net/2019/05/20/does-huaweis-android-ban-give-sony-xperia-a-fighting-chance/ … via @XperiaBlog;#Android
1130908373795450881;2019-05-21;Google and Android American companies cancel the licence of huawei;
1130908324453654528;2019-05-21;Get ready for the great Huawei-Android war of independence http://tnw.me/BSdfjSV;
1130908230689972225;2019-05-21;Huawei puts Honor above Android at new smartphone launch;#Huawei #launches #new #Honor #phones #Android
1130908212197318656;2019-05-21;Latest from the Blog: Alternatif OS de Huawei serait capable de lancer des apps Android http://bit.ly/2EnFTXE;
1130908153028255744;2019-05-21;#BeSmart | Huawei’s Android alternative is coming this fall with Android app compatibility | http://bit.ly/2LSsWrm | #GeekOn #gadget #tech;
1130908138285219841;2019-05-21;@EE what happens with Huawei phones that are still in contract now that they no longer have an android license? Will there be any replacement devices or compensation?;
1130908129301016577;2019-05-21;Huawei users looking for new shits... #huawei #huaweiban pic.twitter.com/u4VqAslkMI;#news #technology
1130908024191606784;2019-05-21;Huawei Honor 20 Pro launches with 4 rear cameras, includes Android despite Google || ban || This super affordable phone from Huawei's Honor is shaping up to be a cheaper P30. https://cnet.co/30y6f2z via @CNET;
1130907966406823936;2019-05-21;US delays #Huaweiban for 90 days https://www.sporela.com/index.php/latest-global-business-news/7635-us-delays-huawei-ban-for-90-days … #huawei pic.twitter.com/XfiPe0b492;
1130907947033387008;2019-05-21;They already have there OS and Huawei users will still use android until August when Huawei contracts expires So Huawei OS is ready but till August;
1130907831119613953;2019-05-21;Breaking News: Huawei loses access to Android and Google, effective immediately https://www.techjuice.pk/huawei-loses-access-to-android-and-google-effective-immediately/ …;
1130907714870288384;2019-05-21;Google Will Hold Off Its Suspension of Android Services to Huawei for 90 Days https://buff.ly/2M1YmiA;
1130907697853947915;2019-05-21;Huawei launches two new smartphones honor 20 and honor 20 pro. The two top specs phones. . Both phones will run on Huawei's modified version of android pie called Magic UI 2.1! #huawei #huaweiindia #honor20 #honor20pro https://www.instagram.com/p/BxvBqhPHUDg/?igshid=jggeuzz4v9xq …;
1130907683383418880;2019-05-21;Can Huawei smartphones still run with Android? http://feedproxy.google.com/~r/euronews/en/home/~3/LphV3MHsuRc/can-huawei-smartphones-still-run-with-android …;#smartphone #Google #Android #Huawei #druckerinthenewspic
1130907647937601536;2019-05-21;Heard Huawei already has an alternative OS, Hongmeng, for it's Android devices.;
1130907625577537536;2019-05-21;'COS' is the name of the already in existence Chinese operating system that is equal to Google and Android. To paraphrase a Japanese admiral, 'President Trump has awakened a sleeping giant' Huawei will just use COS under a different name and immediately out compete Google?;
1130907625049079808;2019-05-21;Huawei launches new Honor phones, doesnt mention Android (Reuters: Money News) http://dlvr.it/R58GPZ;#capitalexits #acquisitions #mbopic
1130907574914756608;2019-05-21;"[Euronews] "" Can Huawei smartphones still run with Android? http://ow.ly/TC8x101Bdoi "" | @euronewspic.twitter.com/MWxkmsnmf9";
1130907164351115264;2019-05-21;The future? The future is Android Q.. but not on this phone;
1130907095656796165;2019-05-21;Android and Huawei could dominate the world if they got rid of the retards using @LinkedIn and disagreeing with a way to benefit the company BUTT only @UnburntWitch would not understand this or agree it's a good thing lol shows what your true motives arehttps://www.theverge.com/2019/5/10/18564129/india-google-android-antitrust-concerns-eu-fine-investigation-cci …;#Save
1130907016740954113;2019-05-21;Huawei responds to Android ban https://www.theverge.com/2019/5/20/18632234/huawei-android-ban-response-google-security-updates?utm_campaign=theverge&utm_content=entry&utm_medium=social&utm_source=twitter … via @Verge;#Huawei #Android #Windows
1130906996872376320;2019-05-21;Google banning android support for huawei is more of a political power move than a actual reaction to a problem. #Huawei;
1130906912571183104;2019-05-21;Huawei launches new Honor phones, doesn’t mention Android https://theworldnewsonline.com/huawei-launches-new-honor-phones-doesnt-mention-android-2/ …;
1130906873224474624;2019-05-21;Huawei Mate 20 Pro pulled from the Android 10 Q beta program pic.twitter.com/I7hfMfRGpl;#technology
1130906841196716032;2019-05-21;Google Will Hold Off Its Suspension of Android Services to Huawei for 90 Days https://www.inc.com/business-insider/google-huawei-reprieve-android-suspension.html … #management #startuppic.twitter.com/Cn1Vt7wWXQ;
1130906823081582601;2019-05-21;Enterprise Talk | Facing google blockage, Huawei’s smartphone business outside China will break, as they lose access to updates to Google’s Android operating system For more insightful reads https://enterprisetalk.com/ #Google #Huawei #USChinaTradeWar #Chinapic.twitter.com/YKYws3w4qU;
1130906681754443778;2019-05-21;Google reverses decision to cut ties with Huawei after US eases trade restrictions via /r/technology http://bit.ly/2WWbAi3 #tech #android #apple #gamer #gadget #samsung #S8 #iPhone7 #twitter;
1130906639660396545;2019-05-21;on @YouTube: Huawei Announces New Mobile OS: Android Compatibility and App Store! https://youtu.be/11_mMVPxQC4;
1130906629539389440;2019-05-21;"m'tell you something: Huawei may have a ""backup"" OS, and it may even run Android apps, but it doesn't have an ""Android rival."" It has a backup OS that can run Android apps. Like Fire OS. It will be missing 95% of the features that make Android special. Period.";
1130906601622315009;2019-05-21;Huawei Mate 20 Pro removed from Android Q Beta page - https://9to5google.com/2019/05/21/huawei-mate-20-pro-android-q-removal/ …;
1130906489693102081;2019-05-21;America hates competition ,if you are doing better than them they will try to pull you down ,keep up huawei , the bad part is google has said it won't be improving or updating android softwares for new huawei phones.;#BeGeek #GeekOn #Techpic
1130906481732120582;2019-05-21;How the U.S. war on #Huawei could hurt millions of Google #Android users. pic.twitter.com/4Z0ec017iU https://twitter.com/cgtnamerica/status/1130639183104618496 …;
1130906411121205249;2019-05-21;Perhaps the U.S. Commerce Dept will grant Google a license to provide Huawei with Android security updates for existing phones in the field.;
1130906363960283136;2019-05-21;Software & security updates for Huawei's Android phones are delivered by Huawei or wireless carriers. Those updates are being cut off in three months unless the U.S. and China come to terms. /2;
1130906365080162304;2019-05-21;Huawei's ban by the US government and Google is devastating for the company and it's users, but could potentially affect not just all other Android users, but even iPhone users as well. Allow us to explain: http://www.tzperspective.com/index.php/2019/05/21/what-huaweis-ban-by-google-means-for-you/ …;
1130906257227997185;2019-05-21;Yes I total agree, but rumor has it that the ban is actually targeted to the 5G technology they built and Huawei can negotiate to have the android license restore;
1130906191771656192;2019-05-21;Huawei ban causes trade-ins to surge as news breaks of Android block https://www.techradar.com/news/huawei-ban-causes-trade-ins-to-surge-as-news-breaks-of-android-block …;
1130906143419580416;2019-05-21;The poison that doesn't kill me makes me stronger ... Welcome #HongMeng #HongmengOS #Huawei #ChinaUS #HuaweiForever @Google #android;
1130906054206918656;2019-05-21;Huawei Honor 20 Pro launches with 4 rear cameras, includes Android despite Google ban - CNET - +GENERAL PHYSICS LABORATORY (GPL) http://img.youtube.com/vi/NLWBvpOziEA/0.jpg … Huawei Honor 20 Pro launches with 4 rear cameras, includes Android despite Google ban CNETThe Honor . ... pic.twitter.com/83PSWRXzdT;#Holochain #bitcoin #ethereum #ripple #xrp #hot #btc #eth
1130906026918719490;2019-05-21;Huawei Honor 20 Pro launches with 4 rear cameras, includes Android despite Google ban - CNET - +GENERAL PHYSICS LABORATORY (GPL) http://img.youtube.com/vi/NLWBvpOziEA/0.jpg … Huawei Honor 20 Pro launches with 4 rear cameras, includes Android despite Google ban CNETThe Honor . ... pic.twitter.com/w7YUQun6xa;#Europe
1130906007717273603;2019-05-21;Huawei is planning to launch its own rival Android operating system 'this Autumn' https://www.independent.co.uk/life-style/gadgets-and-tech/news/huawei-android-rival-operating-system-google-ban-release-date-a8924051.html?utm_medium=Social&utm_source=Twitter#Echobox=1558461371 …;#infosec #cybersecuritypic
1130905940029575168;2019-05-21;I've used a fair few 'droids myself. Samsung and Huawei included. Yes Huawei make awesome phones BUT, my OnePlus 6T is also one of the best phones I've ever used. - I'm actually sort of hoping that the Chinese brands actually work together and develop an alternative to 'droid.;
1130905934111416327;2019-05-21;Huawei CEO says company’s own OS will run Android apps - reports @StanysBujakera @actualitecd @rkitsitahttps://www.rt.com/news/459924-huawei-os-android-apps/ …;
1130905864116813826;2019-05-21;√ Huawei, Android, and Cybersecurity #ITRTG #tech ➾ http://dlvr.it/R58FR8 pic.twitter.com/zkCOhLDx4A;#Sony #Huawei
1130905826003214336;2019-05-21;Huawei Mate 20 Pro no longer included in Android Q beta program http://bit.ly/2VTTQaz http://bit.ly/2HHTlqg;
1130905634554167297;2019-05-21;Located in Canada, was going to purchase the P30 Pro this week. Now with this problem, does this mean no Android 10, 11, etc. Only security updates ? Thanks @HuaweiMobile @Huawei_Canada @HuaweiMobileCAN;
1130905513028399104;2019-05-21;Competition Samsung is facing from Huawei just died! It’s also worth mentioning that the high standard Huawei is bringing to Android will be lost!;
1130905465641209857;2019-05-21;maybe we'll see more mobile pureOS (the os on the librem 5) adaptations with huawei's ban on android? 0:;
1130905455767752704;2019-05-21;Do you already have a Huawei or Honor smartphone? Then nothing should change immediately for you, as Google’s Android Twitter account confirmed. “We assure you while we are complying with all US gov’t... https://www.facebook.com/raiyan.zaman.18/posts/2274839359434050 …;
1130905438881538048;2019-05-21;Huawei Mate 20 Pro no longer included in Android Q beta program https://mobilesyrup.com/2019/05/21/huawei-mate-20-pro-android-q-beta-program/ …pic.twitter.com/96VOyyApdT;#BeSmart #GeekOn #gadget #tech
1130905434297176064;2019-05-21;#TradeWars: #Huawei CEO says company’s own OS will run #Android apps - reports — RT World News https://www.rt.com/news/459924-huawei-os-android-apps/?utm_source=browser&utm_medium=aplication_chrome&utm_campaign=chrome …;
1130905412285415424;2019-05-21;Huawei Could Launch Its Android Alternative By The Fall https://www.ubergizmo.com/2019/05/huawei-could-launch-its-android-alternative-by-the-fall/?utm_source=mainrss …;
1130905276645826560;2019-05-21;It's not a good time for Huawei to show Android's presence inside its phones https://twitter.com/ReutersTech/status/1130898765232136192 …;#huawei #huaweiban
1130905267485511680;2019-05-21;Huawei Mate 20 Pro Has Been Delisted From the Android Q Beta Program https://techweez.com/2019/05/21/huawei-mate-20-pro-delisted-android-q-beta/ …pic.twitter.com/gTpZLgQvCq;
1130905224560951308;2019-05-21;Huawei Mate 20 Pro Has Been Delisted From the Android Q Beta Program https://techweez.com/2019/05/21/huawei-mate-20-pro-delisted-android-q-beta/ …pic.twitter.com/l0ZWzKSsZO;
1130905184471699456;2019-05-21;#Reviews #Android #Huawei Honor 20 Pro hands-on review http://dlvr.it/R58F55 pic.twitter.com/jEi4Ox6zjQ;#Huaweiban #huawei
1130905077290536961;2019-05-21;Huawei HongMeng new OS and 5G-Nothing to worry about losing support from Android #huaweinewos #huawei5g #huawai #hongmengos #android #huaweiandroid #newos #5g;
1130904900626452482;2019-05-21;Leave that guy alone. He know little about OS! Even the CEO of Huawei mobile said “said to be honest we prefer to use Android compared to their HonhMeng OS”. Samsung is the greatest beneficiary of this ban! No other OS can handle foldable phones right now. So the foldable ...;
1130904602440798208;2019-05-21;China doesn't play. Good night become the next yahoo! They made the biggest mistake by suspending Huawei from Android updates and future devices access to the Play Store. Google had no competition, but now they created one. They must prepare for it because it might be better.;
1130904456084754432;2019-05-21;https://www.androidchamp.net/huawei-hongmeng-os-and-5g-nothing-to-worry-about-losing-support-from-android/ … Huawei HongMeng new OS and 5G-Nothing to worry about losing support from Android #huaweinewos #huawei5g #huawai #hongmengos #android #huaweiandroid #newos #5g;#huawei #huaweiindia #honor20 #honor20pro
1130904211829473281;2019-05-21;Google blocks Huawei access to Android updates after blacklisting https://www.theguardian.com/technology/2019/may/19/google-huawei-trump-blacklist-report?CMP=share_btn_tw …;
1130904199670239232;2019-05-21;I think Huawei of all companies have made pretty darn sure to remove (or at least hide) anything that even resembles covert surveillance especially in foreign markets. Why does nobody care that apple added https://www.idownloadblog.com/2017/06/09/ios-11-auto-answer-calls/ … spying feature.;
1130904131848347648;2019-05-21;Huawei may debut its Android alternative as soon as this fall - Engadget https://fook.news/JDYe7v;
1130904098402758656;2019-05-21;"@realDonaldTrump @CNN @MSBC What the Fu¢k! Trump! “Huawei's Android;= The 2nd Largest Phone MFG in the World .... I need “ #Google” (90 Day's for what) Leave China* the fu¢k alone! Oh Snap! China's Year of the #Yearofthepig Ru #TariffThatShit";
1130904079969001472;2019-05-21;Seems like Huawei has found an alternate solution for the android ban. I bet this could change the history of operating systems which will be more easy and better than Android,IOS #Huawei #HuaweiForever #HuaweiP30 #HuaweiP30Pro #Android #bellpic.twitter.com/gD6aWGYCSI;
1130903971906957317;2019-05-21;Loool so this is why google have restricted Huawei from using Android https://twitter.com/zlj517/status/1130545053355663362 …;
1130903951618916352;2019-05-21;Huawei blockade: do I need to stop using my Android phone? | Technology | The Guardian https://www.theguardian.com/technology/2019/may/20/huawei-blockade-do-i-need-to-stop-using-my-android-phone …;
1130903943138070528;2019-05-21;How Google's Huawei license ban could change Android and smartphones forever https://www.pcworld.com/article/3396190/google-huawei-android-apps-play-store-future.html … via @pcworldpic.twitter.com/v8AXtAZj2J;
1130903834212143104;2019-05-21;I should say that it was a cheap move by the U.S government banning Huawei from trading with any U.S company. Now Huawei will have no access to Android, not anymore I far as I've heard. That could be a turning point for Huawei as they'll prove themself or they'll face their worse;#Huawei
1130903804528988161;2019-05-21;Huawei launches new Honor phones, doesn't mention Android http://www.reuters.com/article/us-huawei-tech-usa-honor-idUSKCN1SR1V6?utm_campaign=trueAnthem%3A+Trending+Content&utm_content=5ce43f1aa78c460001091d91&utm_medium=trueAnthem&utm_source=twitter …pic.twitter.com/3QKPEM18ca;
1130903756814594048;2019-05-21;Come on Huawei, let those who bullies you shakes!;
1130903747339706368;2019-05-21;HONG KONG: Google’s decision to partially cut off Huawei devices from its Android OS has presented the Chinese tech titan with one of its most dramatic challenges yet @Huawei;
1130903735117463555;2019-05-21;Huawei Honor 20 Pro launches with 4 rear cameras, includes Android despite Google ban – CNET http://dlvr.it/R58DG5 pic.twitter.com/f4IVd2baMA;#management #startuppic
1130903713206415360;2019-05-21;That includes Google who, in complying with that order, cut off Huawei’s Android license and pulled Play Store and Google app support from future (!!!!!!!) Huawei devices.;#Google #Huawei #USChinaTradeWar #Chinapic
1130903710115221507;2019-05-21;I'm hoping that Xiaomi, OnePlus and Huawei pool resources and build an alternative OS and app ecosystem.;#tech #android #apple #gamer #gadget #samsung #S8 #iPhone7 #twitter
1130903677441593345;2019-05-21;What if - hypothetically - a third party Android app store opened from a company in a neutral country. Would a Spanish/Brazilian/Indian app store be banned from working with Huawei? Could US apps be blocked from it?;
1130903630536560641;2019-05-21;LATEST: Huawei has just three months of Android updates before Google lock-out, US warns – The Independent http://journalism-now.co.uk/huawei-has-just-three-months-of-android-updates-before-google-lock-out-us-warns-the-independent/ …;
1130903588027478016;2019-05-21;Google and Microsoft banned #Huawei from using their operating systems android. https://www.youtube.com/watch?reload=9&v=YJCpBpAvqMM …;
1130903367507742725;2019-05-21;Huawei launches new Honor phones, doesn't mention Android https://reut.rs/2QgZQnw pic.twitter.com/xiQnFTMTWw;
1130903267863662592;2019-05-21;Not the best time to be a Huawei mobile phone user hey. #huaweiban;#Huawei #Android
1130903085394669573;2019-05-21;Huawei is working on a backup OS that natively runs Android apps http://flip.it/BDlTKG;
1130903082752204800;2019-05-21;Let's hope this forces Huawei, OnePlus and Xiaomi to pool resources and develop an alternative OS and app ecosystem. I like 'droid. But I can't support what you have done here.;
1130903080474685440;2019-05-21;Huawei Users right now after Google & Android support dropped off from Huawei pic.twitter.com/3cpZUmERDk;
1130902878728708096;2019-05-21;"RT @CreedHackers: Jion @absoluteappsec on their live discussion on ""Huawei and android security"" https://youtu.be/BZ0U7K0IxNQ #Android #AppSec #infosec #CyberSecurity";
1130902769337012227;2019-05-21;#HuaweiForever Huawei is going to beat iphone very soon... A huge declination is found in the sale of Samsung phones.. Whereas Xiaomi and Vivo are too improving their status.. #Android #vivo #oppo #Xiaomi #Applepic.twitter.com/rjJANxWnPe;
1130902728136380416;2019-05-21;New podcast! In this episode, myself and @freshcres4real talk about the OnePlus 7 Pro, the direction of OP, and the current state of Chinese Android OEMs amidst the sanctions against Huawei and what that means to them and the entire industry. Thank you for listening! Links below:;#HongMeng #HongmengOS #Huawei #ChinaUS #HuaweiForever #android
1130902693499658240;2019-05-21;Huawei launches new Honor phones, doesn't mention Android http://www.reuters.com/article/us-huawei-tech-usa-honor-idUSKCN1SR1V6?utm_campaign=trueAnthem%3A+Trending+Content&utm_content=5ce43f1aa78c460001091d91&utm_medium=trueAnthem&utm_source=twitter … pic.twitter.com/l118hllyp9 #tech;
1130902693214531584;2019-05-21;#Huawei has done nothing wrong.We want quality and security,we want huawei #google #android https://www.youtube.com/watch?v=IfxfdHJ3k9Y …;
1130902622699970560;2019-05-21;Huawei Mate 20 Pro pulled from the Android 10 Q beta program https://www.ultimatepocket.com/?p=8726;#Echobox
1130902578341003264;2019-05-21;Huawei launches new Honor phones, doesn't mention Android http://www.reuters.com/article/us-huawei-tech-usa-honor-idUSKCN1SR1V6?utm_campaign=trueAnthem%3A+Trending+Content&utm_content=5ce43f1aa78c460001091d91&utm_medium=trueAnthem&utm_source=twitter …pic.twitter.com/Xrq0m9RIxc;
1130902528210739205;2019-05-21;Companies of usa will suffer because huawei have contribute alot towards the growth and development of android and it will still remain in its position because they have already planned for it.;
1130902464889217024;2019-05-21;Huawei launches new Honor phones, doesn't mention Android http://www.reuters.com/article/us-huawei-tech-usa-honor-idUSKCN1SR1V6?utm_campaign=trueAnthem%3A+Trending+Content&utm_content=5ce43f1aa78c460001091d91&utm_medium=trueAnthem&utm_source=twitter …pic.twitter.com/5fCjvsWHb1;#ITRTG #tech
1130902402801000449;2019-05-21;every other company using android will take actions and develop their own OS , Huawei got 1 since 2012 and Samsung got one too , Trump is messing up big time;
1130902223611994113;2019-05-21;Huawei Honor 20 Pro launches with 4 rear cameras, includes Android despite Google ban – CNET https://golftw.info/?p=104094;
1130902218662715393;2019-05-21;Huawei launches new Honor phones, doesn't mention Android http://dlvr.it/R58ByJ pic.twitter.com/s3ufrCmzy6;
1130902182327390215;2019-05-21;This isn't about forking Android or hardware independence - it's about the fact that outside of China Huawei phones will be useless without Google Play Services. How many people outside of China would buy an Android phone without the Play Store, YouTube, Gmail, etc. https://twitter.com/RonAmadeo/status/1130892611953336325 …;
1130902073682419712;2019-05-21;#Huawei should consider buying #Aptoide and create a bigger Android market competitor to Google playstore. A tech war ahead of us. Nothing beats P30 for now.;
1130902022545395712;2019-05-21;I was going to change to the huawei p30 pro but now with the google android issue i guess I’ll be stuck with this phone for a while longer;
1130901912906358785;2019-05-21;Huawei's own OS is coming in Fall, features Android app compatibility - gizmochina https://goo.gl/fb/TMjPA9;#TradeWars #Huawei #Android
1130901875346300928;2019-05-21;Looking http://forward.to be able to use my Huawei devices without Android..even if it means I will have to invest in a few new Huawei ecosystem supprted devices;
1130901834644828161;2019-05-21;Huawei launches new Honor phones, doesn’t mention Android https://ibexnews24.com/2019/05/huawei-launches-new-honor-phones-doesnt-mention-android/ …;
1130901823789895680;2019-05-21;@xdadevelopers posted that Huawei is working on an OS. It's going to take time and it's going to support Android apps.;
1130901816701595648;2019-05-21;Huawei Blacklisted By US #android #Apple #ban #blacklist #China #donaldtrump #economy #gmail #Google #googlemaps #huawei #news #pakistan #playstore #samsung #siliconvalley #Technology #trade #unitedstates #us https://hitinpakistan.com/huawei-blacklisted-by-us/ …pic.twitter.com/qy2RJFhpyw;
1130901745163390981;2019-05-21;Reality Check: Fear of Losing Surveillance on Citizens, Makes Google to Restricts Huawei’s Use of Android http://bit.ly/2Qe45R3;#Reviews #Android #Huawei
1130901710174425088;2019-05-21;I guess google is hoping now to improve their pixel sales. I am curious how this will end up in the end. But I cant await huawei to come up with their own operating system. They proved that they are able of doing incredible good jobs.;#huaweinewos #huawei5g #huawai #hongmengos #android #huaweiandroid #newos #5g
1130901669942845440;2019-05-21;Huawei Considers Rivals To Google's Android After US Ban http://bit.ly/2X3vxUh;
1130901606919229442;2019-05-21;Huawei Mate 20 Pro pulled from the Android 10 Q beta program https://www.gsmarena.com/huawei_mate_20_pro_pulled_from_the_android_10_q_beta_program-news-37152.php …;
1130901557417897984;2019-05-21;Google and Android system start to cut ties with Huawei | eNCA https://www.enca.com/business/google-and-android-system-start-cut-ties-huawei?utm_medium=Social&utm_source=Facebook&fbclid=IwAR00SmJu5bjuhZ8MjsQ3CePCffIcwHOJwgqFBoHjh3WyDnW8yhX5xGU3WEY#Echobox=1558352985 … @MTimmal just now in;#huaweinewos #huawei5g #huawai #hongmengos #android #huaweiandroid #newos #5g
1130901482226757640;2019-05-21;The 90-day license that @CommerceGov granted to #mobilephone companies and #internet broadband providers to continue working with #Huawei allows #Google to send software updates to Huawei phones which use its #Android operating system through to August 19. https://hubs.ly/H0hZg5X0;
