id,date,text,hashtags
1132306051926286336,2019-05-25 15:22:54+00:00,"#Huawei ( #Honor ) in big trouble after blacklisted in #US . So now no #USA company will do business with Huawei . Huawei are planning to replace #Android on their existing running phones in the market, 90 days are… https://www.instagram.com/p/Bx4_CDpgKIn/?igshid=3ekfceyvfqub …",#Huawei #Honor #US #USA #Android
1132305540690923520,2019-05-25 15:20:52+00:00,"@Google should treat all brands equally. Therefore, Google should reject these decisions. Today Huawei, maybe tomorrow Samsung, LG etc. This is unacceptable and should never be accepted. Google is an independent company and must act accordingly. @Android @Huawei @HuaweiMobilepic.twitter.com/Jl9KY0erqe",
1132305251988627457,2019-05-25 15:19:43+00:00,"Even without Android, Huawei could reshape the smartphone landscape https://www.androidauthority.com/huawei-android-reshape-smartphones-988370/ …",
1132304958328492032,2019-05-25 15:18:33+00:00,"@HiHonorIndia i am a 9lite user. I want to know that after ban of @Huawei in usa, is my 9lite will get android updates in future.?",
1132304704464199686,2019-05-25 15:17:33+00:00,Huawei has announced a new system for Huawei phones in 2020 and has made it clear that it is an alternative to the Android system and an Apple market competitor and will carry the name HongMeng. The company said sales statistics are growing despite the US embargo! #Huawei,#Huawei
1132304263869227008,2019-05-25 15:15:48+00:00,Huawei’s New OS is Reportedly 60% Faster than Android & Expected to be Out By Oct https://goodyfeed.com/apppreview1646/,
1132303679527182336,2019-05-25 15:13:29+00:00,ehhh may beef diba about huawei and android ???,
1132303542016831488,2019-05-25 15:12:56+00:00,Oppo + Realme = Xiaomi + Poco = Huawei + Honor...But WHY??? https://youtu.be/_myVvS9ccfE via @YouTube #opporealme #huaweiban @oppomobileindia @realmemobiles @Xiaomi @IndiaPOCO @HuaweiMobile @Honorglobal,#opporealme #huaweiban
1132303449603710976,2019-05-25 15:12:34+00:00,"Google has more control over Android than we realize, and right now, companies like Huawei have no other choice but to accept that (GOOG, GOOGL) http://dlvr.it/R5Pmtr pic.twitter.com/HsOL6mN9D7",
1132303390380306435,2019-05-25 15:12:20+00:00,I bet Samsung is is still going to be the biggest smartphone phone company By the way things are looking up for Huawei they is dead No SD No Android No future,
1132303147140026368,2019-05-25 15:11:22+00:00,Huawei’s New OS is Reportedly 60% Faster than Android & Expected to be Out By Oct https://goodyfeed.com/apppreview1646/,
1132303104542687232,2019-05-25 15:11:11+00:00,Huawei’s New OS is Reportedly 60% Faster than Android & Expected to be Out By Oct https://goodyfeed.com/apppreview1646/,
1132303078567305217,2019-05-25 15:11:05+00:00,"It's terrible to witness these things. No matter what Huawei does, making a standalone OS is not an easy feat. Add into that the trust Android and iOS have.",
1132302833221558274,2019-05-25 15:10:07+00:00,Twitter Web App Twitter For IPhone Twitter for Android....can we save Huawei?,
1132302662379233282,2019-05-25 15:09:26+00:00,I'm walking Huawei: here are 4 great Android phones you can buy instead http://tnw.me/f39Vlub - via thenextweb,
1132302640107462657,2019-05-25 15:09:21+00:00,I'm walking Huawei: here are 4 great Android phones you can buy instead http://tnw.me/f39Vlub,
1132301924521451520,2019-05-25 15:06:30+00:00,@koodo What happens if Huawei phones totally lose Android and we're on contract?,
1132301805642244096,2019-05-25 15:06:02+00:00,Huawei’s New OS is Reportedly 60% Faster than Android & Expected to be Out By Oct https://goodyfeed.com/apppreview1646/,
1132301531158634496,2019-05-25 15:04:56+00:00,Huawei banned from using SD cards in all future devices http://www.trickhatmedia.com/huawei-banned-from-using-sd-cards-in-all-future-devices/ … #Huawei #HuaweiBan #SDCards #SmartPhone #microSDCard #USBan #ChinasHuawei #Gadget #THM #TrickHatMediahttp://www.trickhatmedia.com/huawei-banned-from-using-sd-cards-in-all-future-devices/ …,#Huawei #HuaweiBan #SDCards #SmartPhone #microSDCard #USBan #ChinasHuawei #Gadget #THM #TrickHatMediahttp
1132301391161114625,2019-05-25 15:04:23+00:00,"This week’s top stories: Huawei cut off from US tech, Pixel vs ‘Phone X’, more http://bit.ly/2M6Eefn #Android pic.twitter.com/cS0BAuyb0s",#Android
1132300888565997569,2019-05-25 15:02:23+00:00,"I complained to Amazon customer service on the phone and they said hey we are sorry, try after 3 hours our tech team is working on it and its been a week since then. AND yes I'm using your LATEST appon Android. Btw I use Huawei Honor 8",
1132300410830483456,2019-05-25 15:00:29+00:00,I think there is no need to go for iPhone as it runs on iOS not Android platform..... And you should go for Asus like brands and throw away chiness cheap hardware.,
1132298746384003073,2019-05-25 14:53:52+00:00,Who Needs Google’s Android? Huawei Trademarks Its Own Smartphone OS https://contacted.org/2019/05/who-needs-googles-android-huawei-trademarks-its-own-smartphone-os/ …,
1132297864615534592,2019-05-25 14:50:22+00:00,"Forget the headlines, it's not about Huawei. There is no coming back from the Huawei, Google, Android saga. https://www.itweb.co.za/content/Kjlyr7wdwXpMk6am …",
1132297780821577728,2019-05-25 14:50:02+00:00,I don't need a chiness os I am happy with us based android but I would have been very glad to have a indian home grown is in my smart phone. ..and I hope Jio will avoid huawei hardware during their rollout of 5 g in India.Chiness are very suspicious in tech field.,
1132297615440138240,2019-05-25 14:49:23+00:00,I don't need a chiness os I am happy with us based android but I would have been very glad to have a indian home grown is in my smart phone. ..and I hope Jio will avoid huawei hardware during their rollout of 5 g in India.Chiness are very suspicious in tech field.,
1132295337429725185,2019-05-25 14:40:20+00:00,fuck china! fuck huawei #Huawei #huaweiban,#Huawei #huaweiban
1132294304402202625,2019-05-25 14:36:13+00:00,Huawei's New OS Will Support All Android Apps http://bit.ly/2wkzisA,
1132294000453591041,2019-05-25 14:35:01+00:00,Interesting @youtube about the impact of #USA sanctions on @Huawei It shows that companies are dependent on an intricate network of suppliers https://buff.ly/2YM0ZGY #HuaweiBan,#USA #HuaweiBan
1132293740620439553,2019-05-25 14:33:59+00:00,"Forget the headlines, it's not about Huawei. There is no coming back from the #Huawei, #Google, #Android saga. https://www.itweb.co.za/content/Kjlyr7wdwXpMk6am …",#Huawei #Google #Android
1132292983209041921,2019-05-25 14:30:58+00:00,Huawei CEO: Company's New OS Will Run Android Apps https://techviral.net/huawei-new-os-run-android-apps/ …,
1132292499232514049,2019-05-25 14:29:03+00:00,Huawei excluded from the American market and Android: an update on the situation: Huawei… https://goo.gl/fb/oySs5L,
1132292391631822849,2019-05-25 14:28:37+00:00,Google removes Huawei P30 Pro and Mate X from Android official website https://techlector.com/google-removes-huawei-p30-pro-and-mate-x-from-android-official-website/ …pic.twitter.com/tTiEgnZeHr,
1132291490275840008,2019-05-25 14:25:02+00:00,How Huawei will survive without official Android support: https://trib.al/qrPMTLI pic.twitter.com/zbnxzMbo4n,
1132290492455182338,2019-05-25 14:21:04+00:00,"√ Huawei could still survive without Android, but not very well #ITRTG #tech ➾ http://dlvr.it/R5Pg5X pic.twitter.com/Y7sdA9DDud",#ITRTG #tech
1132290441804566530,2019-05-25 14:20:52+00:00,"Huawei is my 1 & only. I've no 2nd phone, don't use a tablet. I bought a high-end Huawei so it will be both mobile & tablet in 1. What version of Android is your Neffos? I realised how important Android versions are. My tablet was Android 5 & apps don't support that anymore.",
1132289918825320449,2019-05-25 14:18:48+00:00,#Huawei ka Ram Naam Satya kardiya US ne. How will it affect the present user's? #HuaweiBan,#Huawei #HuaweiBan
1132288313660805120,2019-05-25 14:12:25+00:00,"One of the Google phones from Huawei from a couple of years ago. It's really the best phone I've had. But I wish we had more than just the narrow options offered by monopolies: esp. an open-source cellphone OS. I'd chuck Google, Android, iOS, etc., in a second. Alas, I'm stuck...",
1132287835837534213,2019-05-25 14:10:31+00:00,"Infinix and Techno Looking at Huawei dragging Android, Samsung ,Apple and the US government: pic.twitter.com/2QT0DNXYfk",
1132287306201739265,2019-05-25 14:08:25+00:00,“Twitter for Android” - the irony here is amazing,
1132287298270367744,2019-05-25 14:08:23+00:00,"Huawei could still survive without Android, but not very well - CNET http://bit.ly/2Wnz1DD",
1132286550413402112,2019-05-25 14:05:25+00:00,Google eliminates Huawei P30 Pro and Mate X from the official Android site http://androidgadget.org/en/google-eliminates-huawei-p30-pro-and-mate-x-from-the-official-android-site/ …,
1132286377029120001,2019-05-25 14:04:43+00:00,"Huawei losing membership from the WiFi Alliance doesn't mean Huawei phones won't be able to connect to WiFi! That's Bizarre! It's basically, Huawei won't play a major role in the how WiFi is shaped in the future! #huawei #wifi #5g #lka #usa #vhina #HuaweiBan #colombo #funny",#huawei #wifi #5g #lka #usa #vhina #HuaweiBan #colombo #funny
1132285960257986560,2019-05-25 14:03:04+00:00,Huawei's New OS Hongmeng is 60 Times Faster Than Android #DigitalMarketing #SEO #SocialMediahttps://www.digitalphablet.com/huawei-new-os-hongmeng-60-times-faster-than-android/ …,#DigitalMarketing #SEO #SocialMediahttps
1132285546775162880,2019-05-25 14:01:25+00:00,"Huawei is already looking for a Play Store replacement, talking to Aptoide - Android Police Upgrade to new smartphone with http://bit.ly/2M5R4KS",
1132284538938417153,2019-05-25 13:57:25+00:00,Huawei CEO: Company's New OS Will Run Android Apps https://techviral.net/huawei-new-os-run-android-apps/ …,
1132282450539896832,2019-05-25 13:49:07+00:00,"While I'm no fan of Huawei, nor do I trust Huawei this whole recent situation with the U.S ban on them and the fallout (Android license, SD etc) goes to show how the USA has way too much influence over the global economy. What happened to let the consumer decide?",
1132282429400539136,2019-05-25 13:49:02+00:00,"Oh TP Link! But hey, for rm300, you can actually get a XiaoMi, which is a good brand. Tbh, been thinking about Huawei's predicament recently. It's sad that this P30 of mine, despite being an ultra powerful phone, isn't going to get Android updates in the future.",
1132281876754788352,2019-05-25 13:46:50+00:00,@Huawei can may Huawei Y9 (2019) still get the android update like pie or android q in the future?,
1132280840312872961,2019-05-25 13:42:43+00:00,@HuaweiEMUI can my Huawei Y9 (2019) get the pie or android Q update in the future? #LovefromPhilippines,#LovefromPhilippines
1132280346224091136,2019-05-25 13:40:45+00:00,Huawei CEO: Company's New OS Will Run Android Apps https://techviral.net/huawei-new-os-run-android-apps/ …,
1132280092384796672,2019-05-25 13:39:45+00:00,"Trumpnomics: If you can't beat them, ban them. Huawei has been cut off from American technology. Google has suspended Huawei’s Android license. The Chinese giant has been accused of being a Trojan Horse for Chinese spies. pic.twitter.com/DSUMg6xgqx",
1132279912121999362,2019-05-25 13:39:02+00:00,Huawei's New OS HongMeng is 60 Times Faster Than Android #SocialMedia #SEO #DigitalMarketing https://www.digitalphablet.com/huawei-new-os-hongmeng-60-times-faster-than-android/ …,#SocialMedia #SEO #DigitalMarketing
1132279675722452992,2019-05-25 13:38:06+00:00,Google breaking ties with Huawei is like slaughtering thousands and thousands. #HuaweiBan,#HuaweiBan
1132277321564602368,2019-05-25 13:28:44+00:00,All these Chinese think they are smart...u ban Google and WhatsApp (America's technology) but still use Android n windows....U tryna outsmart ur master!!!,
1132275163330801665,2019-05-25 13:20:10+00:00,Huawei blockade: do I need to stop using my Android phone? https://www.theguardian.com/technology/2019/may/20/huawei-blockade-do-i-need-to-stop-using-my-android-phone …,
1132274548911616001,2019-05-25 13:17:43+00:00,"This is what I do not get, if the Chinese government is spying with Huawei phones... What are they going to do with that info? Find more appropriate animé/hentai for you? Tho I do not approve of spying, I'm not bothered by it. Ps:Government officials should have a costume phone",
1132273720515596288,2019-05-25 13:14:26+00:00,I just want all Android manufacturer to leave android OS for huawei os,
1132273229807149056,2019-05-25 13:12:29+00:00,So we are going to have following upgrades in 2019-2020 1. New Mobile Operating System 2. New Processor Chips (No ARM Aid) 3. New 5G Technology 4. New Portable Micro Storage Technology for Smartphones Best wishes #Huawei #HuaweiOS #USA #China #Android #Microsd #Google #Trumphttps://twitter.com/androidcentral/status/1132010936053784580 …,#Huawei #HuaweiOS #USA #China #Android #Microsd #Google #Trumphttps
1132272857440968704,2019-05-25 13:11:00+00:00,EE's 5G victory and Huawei's Android ban woes: Winners and Losers http://gadgetsclash.com/2019/05/25/ees-5g-victory-and-huaweis-android-ban-woes-winners-and-losers/ …,
1132272588183486464,2019-05-25 13:09:56+00:00,Huawei will continue developing an Android ecosystem that benefits users and the industry. Thanks,
1132272577500594176,2019-05-25 13:09:53+00:00,"Thank you for reaching out to us. We would like to inform you that as the operating system of smart phones, Android has always been an open source, Huawei as an important participant has made a very important contribution to the development and growth of Android.",
1132272361359716353,2019-05-25 13:09:02+00:00,"Google pulls Huawei’s #Android license. A dramatic escalation in the US- #China trade war. Following the US #crackdown on Chinese technology companies, #Google has cut off #Huawei’s Android license, dealing a huge blow to the besieged phonemaker. The Verge https://buff.ly/2HA6MIC pic.twitter.com/XOLkI4KHMn",#Android #China #crackdown #Google #Huawei
1132271727042412545,2019-05-25 13:06:30+00:00,Abt Google suspending business with Huawei and HW said they are prepared for that and are already building their own OS. Its about time a non-US company build an OS for mobile. Android and iOS are having it too good. The time has come.,
1132271454588944390,2019-05-25 13:05:26+00:00,"Yes US has impose ban on Huawei, and they can't use Android/Google apps on their new devices, but existing devices/customers they can use them.",
1132270197325352960,2019-05-25 13:00:26+00:00,Microsoft has stopped selling the Huawei MateBook X Pro in its online store in the wake of the US Government’s blacklisting of the Chinese firm. Watch the video here Source: Techradar #MindanaoDailyMirror #MDM #Huawei #Android #Microsoftpic.twitter.com/XxB04vAtY8,#MindanaoDailyMirror #MDM #Huawei #Android #Microsoftpic
1132270084888469505,2019-05-25 12:59:59+00:00,The result of #Huawei hostility in America . #HuaweiBan in #USA #Apple #NDA #NDA19 #Paris #Venezuela #Iran #ChinaHustle #China #ModiSweep #oil #CrudeOil #5ปีคสช #5Gpic.twitter.com/akQWAQ3Ft6,#Huawei #HuaweiBan #USA #Apple #NDA #NDA19 #Paris #Venezuela #Iran #ChinaHustle #China #ModiSweep #oil #CrudeOil #5ป #5Gpic
1132269821809364992,2019-05-25 12:58:56+00:00,huawei it is HDJSJSJS cant believe i downgraded to android like this :/,
1132269477104689153,2019-05-25 12:57:34+00:00,Honor 20: Huawei Android phone launch defies Donald Trump - Guardian http://bit.ly/2weLo6k,
1132269400831209473,2019-05-25 12:57:16+00:00,"CNET: Huawei could survive without Android, but it wouldn't be pretty. https://www.cnet.com/news/huawei-could-still-survive-without-android-but-it-wouldnt-be-pretty/#ftag=CAD0610abe0f …",#ftag
1132269339313205249,2019-05-25 12:57:01+00:00,"Looks like gradually all standards - USB, Type C connectors, NFC, Fast-charge, etc will be out of bounds for #Huawei devices! Hmmm? #HuaweiBan https://twitter.com/tech2eets/status/1132264487426306048 …",#Huawei #HuaweiBan
1132269060786462721,2019-05-25 12:55:55+00:00,"Hasn't the trade embargo already affecting even the Chinese phone brands? Android, which Huawei runs on is developed by google which is an American company. The enbargo will forbid google selling integral chipsets and other required softwares to Chinese coys. Let's keep watching",
1132269015877996544,2019-05-25 12:55:44+00:00,@HuaweiMobile be like @oneplus . I'm using Huawei p20 lite and still no Android 9,
1132268922739351553,2019-05-25 12:55:22+00:00,Huawei trade ban recap: everything you need to know http://bit.ly/2ExJna9 #Android,#Android
1132268675724193794,2019-05-25 12:54:23+00:00,Huawei says its homemade operating system could be ready to replace Android by early 2020. https://lnkd.in/fnyb3Hc https://lnkd.in/fu9BSgU,
1132268518584537088,2019-05-25 12:53:46+00:00,Why ARM Cutting Ties With Huawei Is Bigger Than Losing Google Support | Android Headlines https://www.androidheadlines.com/2019/05/arm-huawei-cut-off-google-big-deal.html …,
1132268418466549761,2019-05-25 12:53:22+00:00,"Huawei could survive without Android, but it wouldn't be pretty - CNET pic.twitter.com/nI4Nz6YFQC",
1132267093137723392,2019-05-25 12:48:06+00:00,Huawei is about to lunch its own OS wich will be 60% faster thab Android Android Anni deya Ay Mazaq ie,
1132266439916826625,2019-05-25 12:45:30+00:00,@Huawei seems relatively nonplussed as they intend to launch their Android alternative OS HONGMENG this coming fall if its current issues with Google and Microsoft doesn't solve. The OS will support all Android Apps. @HuaweiFacts #kot #Huawei pic.twitter.com/Y7NbLnLiFF,#kot #Huawei
1132266437169549313,2019-05-25 12:45:29+00:00,Huawei P30 Pro and Mate X Removed From Android Official Website http://bit.ly/30IYfvM,
1132266119136464897,2019-05-25 12:44:13+00:00,"This America-China Cyber Security Cold War is very funny, America: No American company should trade with a China (Huawei looses Android OS from Google) China: No sale of iPhones in China iPhones are gonna be assembled in a country where it’s illegal to purchase them.. LMAO",
1132265291776495616,2019-05-25 12:40:56+00:00,Huawei’s Android License Has been Suspended By Google. https://wassisoft.com/2019/05/huaweis-android-license-has-been-suspended-by-google/ …,
1132264713042255873,2019-05-25 12:38:38+00:00,Huawei P30 Pro and Mate X Removed From Android Official Website http://bit.ly/30IYfvM,
1132264487426306048,2019-05-25 12:37:44+00:00,"Going forward, @Huawei can’t officially use microSD cards in its smartphones. #HuaweiBan https://www.firstpost.com/tech/news-analysis/huaweis-future-smartphones-and-laptops-can-not-support-an-sd-or-microsd-card-6700701.html …",#HuaweiBan
1132264095896485888,2019-05-25 12:36:11+00:00,Huawei Has Developed Its Own OS By The Name Of Hongmeng To Rival Android https://l.facebook.com/l.php?u=https%3A%2F%2Fwonderfulengineering.com%2Fhuawei-has-developed-its-own-os-by-the-name-of-hongmeng-to-rival-android%2F&h=AT1-aUARrXL9OoVnbVTOIHR5gh3JwLRc3r1h-bcQbSGR14eiHJDnGQZ4Li3cxU7cz3aH7LrKAdFyBxzk3dWJHN0I6QrZfZaoHcX6L_vyD1VEan_02zoVM_2ze78A4delAv9XN4sHFQ …pic.twitter.com/ly4cPZlbqu,
1132263808142127104,2019-05-25 12:35:02+00:00,Huawei's New OS HongMeng is 60 Times Faster Than Android #SocialMedia #SEO #DigitalMarketinghttps://www.digitalphablet.com/huawei-new-os-hongmeng-60-times-faster-than-android/ …,#SocialMedia #SEO #DigitalMarketinghttps
1132262117153923072,2019-05-25 12:28:19+00:00,"Android Circuit: Samsung's Radical Galaxy Plan, Stunning Pixel 3a Review, Huawei's Android Nightmare via @forbestechhttps://www.forbes.com/sites/ewanspence/2019/05/24/android-news-google-pixel-3a-review-samsung-galaxy-note10-a80-huawei-adobe-premier-leak/#3b506f301089 …",#3b506f301089
1132262021385400320,2019-05-25 12:27:56+00:00,Inside the #Huawei #research center (long before #HuaweiBan ) pic.twitter.com/8pspJ5tlV8,#Huawei #research #HuaweiBan
1132262019661475840,2019-05-25 12:27:56+00:00,#Huawei's New OS #Hongmeng is 60 Times Faster Than #Android https://www.digitalphablet.com/huawei-new-os-hongmeng-60-times-faster-than-android/#.XOk0syuLz0Q.twitter … via @DigitalPhablet,#Huawei #Hongmeng #Android #
1132261868746215424,2019-05-25 12:27:20+00:00,Huawei's New OS HongMeng is 60 Times Faster Than Android https://www.digitalphablet.com/huawei-new-os-hongmeng-60-times-faster-than-android/#.XOk0jNrhk8c.facebook …,#
1132260257701531649,2019-05-25 12:20:56+00:00,Trump won't kill off Huawei. Baiting China on issues of national pride is very foolish. The govt will now spend whatever it takes for Huawei to develop an alternative to Android. They have the capability to make something better. That would be goodnight Google.,
1132259718825684992,2019-05-25 12:18:47+00:00,Huawei CEO: Company's New OS Will Run Android Apps https://techviral.net/huawei-new-os-run-android-apps/ …,
1132259636608811008,2019-05-25 12:18:28+00:00,"Huawei could survive without Android, but it wouldn't be pretty https://cnet.co/2W8RswV via @CNET",
1132259341527134208,2019-05-25 12:17:18+00:00,Confirmed: Huawei OS will be compatible with all Android applications - Huawei Central https://www.huaweicentral.com/confirmed-huawei-os-will-be-compatible-with-all-android-applications/ …,
1132258938769031169,2019-05-25 12:15:42+00:00,Huawei’s New OS is Reportedly 60% Faster than Android & Expected to be Out By Oct https://goodyfeed.com/?p=180935 via @goodyfeed,
1132258766827737088,2019-05-25 12:15:01+00:00,"In case you were wondering, here's an update on the #Huawei and #Android news that broke this week http://bit.ly/2Qn3E6N",#Huawei #Android
1132258719264231424,2019-05-25 12:14:49+00:00,The Huawei Ban: What next? #Huawei #HuaweiBan #DonaldTrumppic.twitter.com/xcxeIBmnMc,#Huawei #HuaweiBan #DonaldTrumppic
1132258543027904512,2019-05-25 12:14:07+00:00,"""Product #Review: Huawei could survive without Android, but it wouldn't be pretty #News"":https://www.robinspost.com/news/reviews/912448-product-review-huawei-could-survive-without-android-but-it-wouldn-t-be-pretty.html …",#Review #News
1132258338417324032,2019-05-25 12:13:18+00:00,"Huawei Evacuated From SD Affiliation and Wi-Fi Union, Google Expels Its Phones From Android Undertaking Gadget List http://bit.ly/2K3TZ43",
1132257302394884096,2019-05-25 12:09:11+00:00,@Huawei will not use stoke android but it seems they have been working on a backup OS since 2012. It’s like they have been bracing themselves for something like this for a while. They figured their reliance on Google and Google services as a bad thing. #huawei #HuaweiFacts #KOTpic.twitter.com/GidwMRbbFP,#huawei #HuaweiFacts #KOTpic
1132256282075836417,2019-05-25 12:05:08+00:00,What's your contingency plan for those Huawei Android phone owners who will be impacted starting August 2019?,
1132256272097718272,2019-05-25 12:05:06+00:00,@Android + WiFi + micro SD what next @HuaweiMobile ? #Huawei #Android #wifi,#Huawei #Android #wifi
1132256209250267136,2019-05-25 12:04:51+00:00,Lol. I am So damn Happy for China. Now here is the Summary *Android has joined USA in the Fight against Huawei *Huawei will launch their Operating System in October *iPhone will be caught up in the Collateral Damage when USA looses the technological war *Huawei's OS will defini,
1132256185678204928,2019-05-25 12:04:45+00:00,We know the chinese are good at what they're doing. Huawei has been working on their OS for 7 years. A third OS is more than welcome to challenge Android and iOS. Huaweis Emui Shell is very good. I wont be surprised if US has to eat their own hat. https://twitter.com/CGTNOfficial/status/1132197107404812289 …,
1132255855930413056,2019-05-25 12:03:27+00:00,Android + WiFi + micro SD what next Huawei Mobile ?,
1132255654662557696,2019-05-25 12:02:39+00:00,Huawei Has Developed Its Own OS By The Name Of Hongmeng To Rival Android https://wonderfulengineering.com/huawei-has-developed-its-own-os-by-the-name-of-hongmeng-to-rival-android/ …,
1132255461976223744,2019-05-25 12:01:53+00:00,It's fair enough. You're hands are tied as you have to adhere to the executive order given by a lunatic. It'll be interesting to see how this pans out in the long term as Huawei are essentially bring pushed into developing their own operating system.,
1132255214399119362,2019-05-25 12:00:54+00:00,"Huawei could survive without Android, but it wouldn't be pretty - CNET http://s.einnews.com/0grDJn2w3K",
1132255041442734080,2019-05-25 12:00:12+00:00,"Huawei could survive without Android, but it wouldn't be pretty - CNET https://www.cnet.com/news/huawei-could-still-survive-without-android-but-it-wouldnt-be-pretty/#ftag=CAD590a51e …",#ftag
1132254825322897408,2019-05-25 11:59:21+00:00,android apps will run on huawei new OS. huawei os or hongmeng os? would have been better if they call it #bandroid!https://techviral.net/huawei-new-os-run-android-apps/ …,#bandroid
1132254743919779840,2019-05-25 11:59:01+00:00,Oh dear... Google severed Huawei's access to key Android apps and services https://buff.ly/2WUpTn0 pic.twitter.com/RUVwk4bpWd,
1132254587983937537,2019-05-25 11:58:24+00:00,"RT @Tomasz_Kubacki: RT @rapplerdotcom: News about Huawei's potential replacement for Android, ""HongMeng,"" trickle out. #TechNews https://www.rappler.com/technology/features/231304-things-to-know-about-hongmeng-huawei-new-operating-system?utm_medium=Social&utm_source=Twitter#Echobox=1558573106 …pic.twitter.com/Rgoqw5ba44",#TechNews #Echobox
