id,date,text,hashtags
1132254409268666369,2019-05-25 11:57:42+00:00,"Android is open-source. AOSP (Android Open-Source Project"") can be used as the base of the phone OS. What is banned is Google Mobile Service (Google Map, YouTube etc.). So no influence on Chinese HUAWEI users but big influence on the rest.",
1132254399760359430,2019-05-25 11:57:39+00:00,Huawei’s New OS is Reportedly 60% Faster than Android & Expected to be Out By Oct https://goodyfeed.com/apppreview1646/,
1132254175411277825,2019-05-25 11:56:46+00:00,Huawei’s New OS is Reportedly 60% Faster than Android & Expected to be Out By Oct https://goodyfeed.com/apppreview1646/,
1132254124534358016,2019-05-25 11:56:34+00:00,Huawei’s New OS is Reportedly 60% Faster than Android & Expected to be Out By Oct https://goodyfeed.com/apppreview1646/,
1132253593778704385,2019-05-25 11:54:27+00:00,"The Honor20 Series has launched and it is what OnePlus Could have been!!!⁣ ⁣ #Honor #Honor20 #Huawei #Android #Google ⁣ ⁣ The Honor20 series is all worthy of a flagship device, with a Kirin980 7nm(nanometer)… https://www.instagram.com/p/BxunOujHY-m/?igshid=1cej6cgja8xh0 …",#Honor #Honor20 #Huawei #Android #Google
1132253425494896640,2019-05-25 11:53:47+00:00,BBC News - Huawei's use of Android restricted by Google https://www.bbc.com/news/business-48330310 …,
1132253112184578050,2019-05-25 11:52:32+00:00,"Take note:- China announced from 1/6, China terminates WeChat and WeChat pay service for all iPhone users. iPhone will lose China phone market. Portugal Aptoide join Huawei Hongmeng totally eclipsed Android &... https://www.facebook.com/1105515246/posts/10217769904375080/ …",
1132251842744848384,2019-05-25 11:47:30+00:00,"Huawei could survive without Android, but it wouldn't be pretty – CNET https://voiceofthehwy.org/archives/542553 pic.twitter.com/gs3kPXdFrX",
1132251468323577861,2019-05-25 11:46:00+00:00,Google offers Huawei a brief reprieve by putting its Android suspension on hold https://buff.ly/2JVWkhf,
1132251453584760835,2019-05-25 11:45:57+00:00,"I'm happy with it. It might not get upgraded to the next Android, but it's pretty good as it is ,and I'm sure Huawei will do its own upgrades.",
1132251219559239680,2019-05-25 11:45:01+00:00,"Huawei OS, however, only has a chance to catch on in China, where Google doesn’t have a presence & where Huawei could easily make an Android of its own. Convincing smartphone users in Western markets to ditch a phone with Google’s Android, will be an uphill battle.",
1132251216052981760,2019-05-25 11:45:00+00:00,"That operating system is based on Android, and it’s supposed to run both on smartphones and tablets. But, make no mistake, Huawei needs Google’s version of Android and Microsoft’s Windows 10, no matter what.",
1132251202073161728,2019-05-25 11:44:57+00:00,#Huawei needs #Google’s #Android and #Microsoft’s #Windows 10 like fish need waterhttps://bgr.com/2019/05/23/huawei-os-vs-android-vs-windows-10-huawei-has-no-chance/ …,#Huawei #Google #Android #Microsoft #Windows
1132251104597696513,2019-05-25 11:44:34+00:00,"A Wall Street firm figured out how much money #Google will sacrifice by cutting off #Huawei (GOOG, GOOGL) #Tech #Business #China #telecom #Trump #Teleco #Technology #Android http://feedproxy.google.com/~r/typepad/alleyinsider/silicon_alley_insider/~3/yUAdZoU9TQ4/wall-street-estimates-google-lost-revenue-huawei-ban-2019-5 …",#Google #Huawei #Tech #Business #China #telecom #Trump #Teleco #Technology #Android
1132251013463891968,2019-05-25 11:44:12+00:00,"Huawei needs Google’s Android and Microsoft’s Windows 10 like fish need water The import ban the Trump administration imposed on Huawei a few days ago was the next logical step in the trade war against China. While some people may have foreseen it, given the ZTE practice ru…",
1132250905875763202,2019-05-25 11:43:46+00:00,"If west goes dark, east will continue to shine. Click on the link below to watch founder of huawei Ren Zhengfei's 1st ever interview to an Intl news agency.... BBC News - The US cannot crush us, says Huawei founder https://www.bbc.com/news/business-47274679 … #Huawei #HuaweiBan",#Huawei #HuaweiBan
1132250796853268481,2019-05-25 11:43:20+00:00,"Microsoft Pulls Huawei Server Products, Laptop Following US Ban via /r/technology http://bit.ly/2K4BZGS #tech #android #apple #gamer #gadget #samsung #S8 #iPhone7 #twitter",#tech #android #apple #gamer #gadget #samsung #S8 #iPhone7 #twitter
1132250668927000576,2019-05-25 11:42:50+00:00,"Huawei could survive without Android, but it wouldn't be pretty – CNET https://qworldnews.com/huawei-could-survive-without-android-but-it-wouldnt-be-pretty-cnet/ …pic.twitter.com/d6pQirC9A0",
1132250557354303490,2019-05-25 11:42:23+00:00,Google Android huawei Love triangle #Huawei #Andriod #Googlepic.twitter.com/xyEfe9WqUZ,#Huawei #Andriod #Googlepic
1132249932604334080,2019-05-25 11:39:54+00:00,"Meanwhile, millions of Android users caught in the Huawei storm remain unaccounted for https://twitter.com/SkyNews/status/1132244349251670016 …",
1132248717543612418,2019-05-25 11:35:05+00:00,"Huawei could survive without Android, but it wouldnt be pretty - CNET (Jessica Dolcourt/Larry Magid at Large) http://dlvr.it/R5PK2p",
1132247187403026432,2019-05-25 11:29:00+00:00,Huawei Has Developed Its Own OS By The Name Of Hongmeng To Rival Android https://wonderfulengineering.com/huawei-has-developed-its-own-os-by-the-name-of-hongmeng-to-rival-android/ …,
1132247071891681280,2019-05-25 11:28:32+00:00,"Huawei could survive without Android, but it wouldn't be pretty - CNET http://dlvr.it/R5PJG9 via @CNET",
1132247020167671808,2019-05-25 11:28:20+00:00,Huawei’s New OS is Reportedly 60% Faster than Android & Expected to be Out By Oct https://goodyfeed.com/apppreview1646/,
1132246896699891714,2019-05-25 11:27:50+00:00,Trump also banned U.S. companies from doing business with Huawei. Huawei needs android as its OS. Users will think twice if Huawei loses android and its playstore. Tough times for Huawei.,
1132246326047940608,2019-05-25 11:25:34+00:00,"#Android Circuit: Radical Samsung Galaxy Plan, Stunning Pixel 3a Review, Huawei's #Android Nightmare http://dlvr.it/R5PJ13 pic.twitter.com/faL4f5s2sP",#Android #Android
1132246322143043584,2019-05-25 11:25:33+00:00,"Huawei could survive without #Android, but it wouldn't be pretty http://dlvr.it/R5PHz4 pic.twitter.com/hduA7OQioj",#Android
1132245340479004672,2019-05-25 11:21:39+00:00,Huawei built its own operating system in case US tensions disrupt use of Google’s Android https://www.scmp.com/tech/big-tech/article/3001685/huawei-confirms-it-has-built-its-own-operating-system-just-case-us?utm_medium=Social&utm_source=Facebook#Echobox=1558337704 …,#Echobox
1132245329238220800,2019-05-25 11:21:37+00:00,"Huawei Developing Its Own New OS To Replace Android According to the latest reports, the well-known Chinese smartphone manufacturer, Huawei developing its own OS to replace Android.… https://www.instagram.com/p/Bx4japml9Nm/?igshid=sunn7uhjhzao …",
1132244671089061890,2019-05-25 11:19:00+00:00,"#China’s #Huawei has issued its first response following the powerful blow it received by withdrawing its own Android operating license from Google, which comes in response to #US government demands. follow us to know details : https://bitlylink.com/yOJoY #Ramadanpic.twitter.com/BrdQD2RRsn",#China #Huawei #US #Ramadanpic
1132244612641370112,2019-05-25 11:18:46+00:00,"Android Q is heading to OnePlus 5/5T, OnePlus 7 Pro features heading to 6/6T . . . . . https://9to5google.com/2019/05/24/oneplus-5-android-q/ … . . . . . . . . . . . . . . . . . . . . . #huawei #oppo… https://www.instagram.com/p/Bx4jGF0AcC2/?igshid=17xj9cory0ydb …",#huawei #oppo
1132244533734006785,2019-05-25 11:18:27+00:00,"Huawei’s New OS ""Hongmeng"" is reportedly 60% faster than Android & expected to be out worldwide By Oct, 2020. #Huawei #HuaweiOS #USChinaTradeWar",#Huawei #HuaweiOS #USChinaTradeWar
1132244184558112768,2019-05-25 11:17:04+00:00,"Another interesting development relevant for this thread . Huawei's New OS HongMeng is 60 Times Faster Than Android https://www.digitalphablet.com/huawei-new-os-hongmeng-60-times-faster-than-android/ … If they do this well it will seriously hit Android Market share in Asia, Africa, Central and South America, in a short timeframe.",
1132243741706735616,2019-05-25 11:15:18+00:00,Google pulls Huawei’s Android license - https://www.osnews.com/story/130040/google-pulls-huaweis-android-license/ …,
1132243519949615105,2019-05-25 11:14:25+00:00,lol can you imagine if you’re Apple and Chinese people boycott you because your nemesis Google stopped supplying Android to Huawei? Boycott Android la really smlj?!,
1132242386250129408,2019-05-25 11:09:55+00:00,"Forget the headlines, it's not about #Huawei. There is no coming back from the Huawei, #Google, #Android saga. https://www.itweb.co.za/content/Kjlyr7wdwXpMk6am …",#Huawei #Google #Android
1132241772590059521,2019-05-25 11:07:29+00:00,Can have a Huawei but without Android,
1132241446210293760,2019-05-25 11:06:11+00:00,Android vs Huawei’s OS is the biggest bet in tech: Will Huawei succeed? http://www.indiaclicking.com/android-vs-huaweis-os-is-the-biggest-bet-in-tech-will-huawei-succeed/ …,
1132240879320752129,2019-05-25 11:03:56+00:00,"Forget the headlines, it's not about Huawei. There is no coming back from the Huawei, Google, Android saga. https://www.itweb.co.za/content/Kjlyr7wdwXpMk6am …",
1132239901506850817,2019-05-25 11:00:03+00:00,Confirmed: Huawei OS will be compatible with all Android applications - Huawei Central https://www.huaweicentral.com/confirmed-huawei-os-will-be-compatible-with-all-android-applications/ …,
1132239766559158272,2019-05-25 10:59:31+00:00,Huawei's New OS Will Support All Android Apps https://interestingengineering.com/huaweis-new-os-will-support-all-android-apps …,
1132239137996722176,2019-05-25 10:57:01+00:00,Google has pulled Huawei’s Android licence. Now what? https://www.blogdady.com/google-has-pulled-huaweis-android-licence-now-what/ …pic.twitter.com/A5OTTemA0F,
1132238207200964608,2019-05-25 10:53:19+00:00,"I've just posted a new blog: Huawei Evacuated From SD Affiliation and Wi-Fi Union, Google Expels Its Phones From Android Undertaking Gadget List http://bit.ly/2K3TZ43 Following the US boycott, Huawei is presently incidentally limited or expelled from a few first class world…",
1132237872948498432,2019-05-25 10:51:59+00:00,"@realDonaldTrump I like Samsung, Acer and Sony devices, with Windows or Android. The autonomy of devices must be enhanced. I had a Huawei router with Jazztel telecommunications, had continuous DNS and IP problems. I hope everything is for security.",
1132237679431692289,2019-05-25 10:51:13+00:00,"Yeah, so about that trade war with China.https://news.cgtn.com/news/3d3d414d7a41544f34457a6333566d54/index.html … #Huawei #5G #Android #China",#Huawei #5G #Android #China
1132237382999322626,2019-05-25 10:50:02+00:00,#android #powerbanks Stylish Starry Matte Fitted Case for Huawei pic.twitter.com/0LDbusd2Qe,#android #powerbanks
1132236955473915904,2019-05-25 10:48:20+00:00,Pop quiz: Which Huawei/Honor phone is this? http://bit.ly/2K1HA0t #Android,#Android
1132236833885237248,2019-05-25 10:47:51+00:00,"The orange buffoon, who doesn't even know CEO of Apple is Tim Cook, look what's he calling in this video. What a moron #HuaweiBan #timcook #Huawei #apple #trumppic.twitter.com/rW0LkSCBb8",#HuaweiBan #timcook #Huawei #apple #trumppic
1132236222544457728,2019-05-25 10:45:26+00:00,"""It's not a difficult task to come up with a new OS, but it's difficult to build up an ecosystem for that"" since it has it's own App Gallery and it can run android apps * which doesn't need GplayServices * this OS might be a great success #Huawei #HONGMENG #HongmengOS #ChinaUShttps://twitter.com/CGTNOfficial/status/1132197107404812289 …",#Huawei #HONGMENG #HongmengOS #ChinaUShttps
1132235932235493376,2019-05-25 10:44:16+00:00,"#huaweiban par different take ki iska India ke future pe kya effect ho sakta hai. Do watch, and share https://youtu.be/j4qyym5AOKg #Huawei #smartphone #technology #YouTube #youtuber @YouTubeIndia @YouTube @YTCreatorsIndiapic.twitter.com/kDRsMs2CfV",#huaweiban #Huawei #smartphone #technology #YouTube #youtuber
1132235427614642177,2019-05-25 10:42:16+00:00,"First no Android, then no Intel, and now no SD cards! 'ThanUS' just snapped everything out of Huawei's universe. Huawei can’t officially use microSD cards in its phones going forward https://www.theverge.com/2019/5/24/18638539/huawei-microsd-card-sd-association-us-trump-ban?utm_campaign=theverge&utm_content=entry&utm_medium=social&utm_source=twitter … via @Verge",
1132235219346452481,2019-05-25 10:41:26+00:00,"HUAWEI HAS JUST THREE MONTHS OF ANDROID UPDATES BEFORE GOOGLE LOCK-OUT, US WARNS https://www.independent.co.uk/life-style/gadgets-and-tech/news/huawei-android-update-latest-google-ban-date-a8923131.html …",
1132234655594422272,2019-05-25 10:39:12+00:00,"""It's not a difficult task to [copy the source code of Android] come up with a new OS, but it's difficult to build up an ecosystem for that [so we’ll just use the existing Android apps],"" Huawei founder and CEO Ren Zhengfei said during an interview on Tuesday.",
1132234616205484032,2019-05-25 10:39:03+00:00,Huawei Google ban: What does the US-China dispute mean for your Android phone? http://tinyurl.com/y5lcbyf8 :Auto pickup by wikyou,
1132234462190743552,2019-05-25 10:38:26+00:00,[Update 8: Removed from Android Enterprise Recommended] Google has revoked Huawei’s Android license https://www.xda-developers.com/google-revoke-huawei-android-ban-blacklist/ … via @xdadevelopers,
1132234333899485186,2019-05-25 10:37:55+00:00,People should realise real reason behind #HuaweiBan. #But #supercountry can do whatever they wants. #Trump's latest #explanation for the @Huawei ban is unacceptably bad http://bit.ly/30KwOSn #securitythreat is a #bluff.,#HuaweiBan #But #supercountry #Trump #explanation #securitythreat #bluff
1132234311103463425,2019-05-25 10:37:50+00:00,People should realise real reason behind #HuaweiBan. #But #supercountry can do whatever they wants. #Trump's latest #explanation for the @Huawei ban is unacceptably bad http://bit.ly/30KwOSn #securitythreat is a #bluff.,#HuaweiBan #But #supercountry #Trump #explanation #securitythreat #bluff
1132234185651904515,2019-05-25 10:37:20+00:00,People should realise real reason behind #HuaweiBan. #But #supercountry can do whatever they wants. #Trump's latest #explanation for the @Huawei ban is unacceptably bad http://bit.ly/30KwOSn #securitythreat is a #bluff.,#HuaweiBan #But #supercountry #Trump #explanation #securitythreat #bluff
1132233871116951552,2019-05-25 10:36:05+00:00,Huawei's New OS HongMeng is 60 Times Faster Than Android #SocialMedia #SEO #DigitalMarketinghttps://www.digitalphablet.com/huawei-new-os-hongmeng-60-times-faster-than-android/ …,#SocialMedia #SEO #DigitalMarketinghttps
1132233232395776000,2019-05-25 10:33:33+00:00,Huawei’s New OS is Reportedly 60% Faster than Android & Expected to be Out By Oct https://goodyfeed.com/apppreview1646/,
1132232543095394309,2019-05-25 10:30:48+00:00,I just published Huawei flagships without Google or Android? This is everything you need to know https://www.publish0x.com/salahchiva/huawei-flagships-without-google-or-android-this-is-everything-you-need-to-know-xyvgdj …,
1132232407258583040,2019-05-25 10:30:16+00:00,Huawei's OS is ready #Hongmeng. Though it wont be easy to make customers switch from Android. https://mybs.in/2X68wsJ,#Hongmeng
1132232197363118080,2019-05-25 10:29:26+00:00,"#huawei is big enough (and enjoys #china regime's backing and funding) to fork #aosp or adopt some existing fork of it. Then, it can compete with #android itself in the long run. A daunting vision for #google no doubt....",#huawei #china #aosp #android #google
1132231881129439232,2019-05-25 10:28:10+00:00,#Huawei says its homemade #operating #system could be ready to replace #Android by early #2020 https://www.updater.website/2019/05/huawei-says-its-homemade-operating.html …,#Huawei #operating #system #Android #2020
1132231797910179840,2019-05-25 10:27:51+00:00,Something that annoys me with my #Huawei mobile: 1. The Timer is unreliable. If I jump into another app the timer may or may not sound off when it should (sometimes minutes late). 2. The Calendar app icon does not show the real date. Are there #Android settings for this? pic.twitter.com/nwTUhACCM8,#Huawei #Android
1132231334833860608,2019-05-25 10:26:00+00:00,"Urgh. Guess I won't be trading in my P20 Pro after all then, not for that crappy price. Cheers for that Trump. https://www.express.co.uk/life-style/science-technology/1131651/Huawei-P20-Pro-price-shock-trade-in-values-Google-Android-ban … #Huawei #PriceCrash #Android",#Huawei #PriceCrash #Android
1132231227241484289,2019-05-25 10:25:35+00:00,Random Dumber Generator: How Hard Is It For Huawei To Fork Android Without Google? ... https://randomdumber.blogspot.com/2019/05/how-hard-is-it-for-huawei-to-fork.html?spref=tw …,
1132231081954910209,2019-05-25 10:25:00+00:00,I am still not clear on what happens to old #huawei phones say Mate10pro which is 2 years old http://now.Google/ Android will be replaced with new OS or just the updates will stop?Can you please reply?Thanks,#huawei
1132230638327795712,2019-05-25 10:23:14+00:00,Britons dump Huawei phones as US-China trade war sparks retail backlash via /r/technology http://bit.ly/2YQ1Kim #tech #android #apple #gamer #gadget #samsung #S8 #iPhone7 #twitter,#tech #android #apple #gamer #gadget #samsung #S8 #iPhone7 #twitter
1132229989712244737,2019-05-25 10:20:40+00:00,Trump’s Attack on Huawei Could Shatter US Monopoly on Operating Systems https://www.strategic-culture.org/news/2019/05/24/trumps-attack-on-huawei-could-shatter-us-monopoly-on-operating-systems/ … by Tim Kirby ( @Strateg_Culture) #geoeconomics #Android,#geoeconomics #Android
1132229601982337024,2019-05-25 10:19:07+00:00,Google cancels Huawei’s Android license after Trump blacklist https://www.techworm.net/2019/05/google-huawei-android-license.html …,
1132229251397234688,2019-05-25 10:17:43+00:00,"What does the USA Blacklist meaning for Huawei?Huawei, can not do Business with Google (No Android), Intel (No i-series Chips), Microsoft (No Windows). How can they survive without these? Why? All USA companies must comply with the blacklist mandate pic.twitter.com/46KyLa2UAK",
1132228832386330625,2019-05-25 10:16:04+00:00,EE’s 5G victory and Huawei’s Android ban woes: Winners and Losers - https://cssc0der.com/ees-5g-victory-and-huaweis-android-ban-woes-winners-and-losers/ … by @cssc0der,
1132228490101743618,2019-05-25 10:14:42+00:00,"After ARM and Intel CPUs, Android, and SD cards, Huawei won’t be able to ship devices with Wi-Fi either. https://asia.nikkei.com/Spotlight/Huawei-crackdown/Huawei-s-voice-in-future-tech-standards-restricted …",
1132227746061537280,2019-05-25 10:11:45+00:00,"I’m optimistic Huawei will survive without Android, unlike Microsoft(Windows), Nokia(Symbian) & Blackberry. Ila kazi wataipata, watu tumekariri Android and iPhone",
1132226611309436928,2019-05-25 10:07:14+00:00,"Forget the headlines, it's not about Huawei. There is no coming back from the Huawei, Google, Android saga. https://www.itweb.co.za/content/Kjlyr7wdwXpMk6am …",
1132226086484533248,2019-05-25 10:05:09+00:00,The most complete analysis Huawei about Android open-sourceness I read: https://www.xda-developers.com/analysis-huawei-aosp-google-ban/ … by @xdadevelopers,
1132225869718663169,2019-05-25 10:04:17+00:00,Samsung now offers trade-ins for Huawei users. #Android http://bit.ly/2JDXvCV,#Android
1132225577434406912,2019-05-25 10:03:08+00:00,Huawei Developing Its Own New OS To Replace Android https://techviral.net/huawei-developing-its-own-os/ …,
1132225425260855301,2019-05-25 10:02:31+00:00,"Here's some good news for those who own a Huawei phone Sure, Huawei owners are concerned right now that their phones might not receive any more updates (either for the Android operating system or for Android apps) after August 19th. And Huawei products… http://bit.ly/2QljKOu pic.twitter.com/1E7KpXaVRf",
1132225247934128128,2019-05-25 10:01:49+00:00,"We still love you Huawei with pics like this, how could you not? F*CK @Android f.u @Googlepic.twitter.com/teWxZHm4ew",
1132225133786083328,2019-05-25 10:01:22+00:00,"Huawei could still survive without Android, but not very well - CNET Upgrade to new smartphone with http://bit.ly/2M5R4KS",
1132225132078993409,2019-05-25 10:01:21+00:00,Google Suspends Android Support After Huawei Is Blacklisted by US Government - Fstoppers Upgrade to new smartphone with http://bit.ly/2M5R4KS,
1132224987195236352,2019-05-25 10:00:47+00:00,Google removes Huawei devices from official Android website http://s.einnews.com/7FwEg9IKCA,
1132224939451473920,2019-05-25 10:00:35+00:00,Google removes Huawei devices from official Android website http://s.einnews.com/7FwEg9IKCA,
1132224912976941056,2019-05-25 10:00:29+00:00,Just because Huawei's Android license was rebuked does not render them obsolete.,
1132224890709446656,2019-05-25 10:00:24+00:00,I love how some Comms Teams / Social Media / Digital Media teams handle things. Here is how Huawei is taking advantage of the US ban. #TradeWars #tradewar #Huawei #HuaweiBan pic.twitter.com/m3qkjujLGm,#TradeWars #tradewar #Huawei #HuaweiBan
1132224393579569152,2019-05-25 09:58:25+00:00,Where do images I download on Huawei/Android go??? Can't share ma memes,
1132223318038388736,2019-05-25 09:54:09+00:00,"1. No, but neither do OSs that use Android app marketplaces. The apps need to be compatible with Android, not the other way around. 2. Doesn't explain why Huawei need to patch vulnerability more often. 3. Well yes, but we're not talking about major functionality upgrades, are we?",
1132223308924182534,2019-05-25 09:54:07+00:00,"For the African tech ecosystem, imho only, the US ban on Android and other Google services for Huawei brand hardware, is probably a timely intervention. It may look challengingly disruptive in the beginning, and PR will certainly convince you so, but in the long run, its freedom.",
1132223060717854720,2019-05-25 09:53:08+00:00,There must be an another mobile OS from out of USA for against to currently dominant Mobile OS of #Android #ios #Apple #Huawei,#Android #ios #Apple #Huawei
1132222818215636994,2019-05-25 09:52:10+00:00,Will existing huawei phones can still have access to Google services apps after the 90 day temporary license cease on August?,
1132222509502410752,2019-05-25 09:50:56+00:00,HUAWEI NOVA 4 - COLORFUL Buy 1 ₱3000 Buy 1 Take 1 ₱4800 Reseller my less pa pm na Specs : ღ Model: Nova 4 ღ Android version: 8.0 Oreo ღ Cpu model: QUAD CORE ARMv7 processor ღ Cores: 4 core ღ Resulotion:... https://www.facebook.com/100000196912872/posts/2798973676785835/ …,
1132222088499146753,2019-05-25 09:49:16+00:00,Huawei needs Google’s Android and Microsoft’s Windows 10 like fish need water – BGR http://bit.ly/2YOtnbw,
1132221946060582912,2019-05-25 09:48:42+00:00,The future of my huawei phone is cursed. #huaweiban,#huaweiban
1132221678937923584,2019-05-25 09:47:38+00:00,Can we get OnePlus phones in South Africa? Since Huawei is going to hell if the shit really hits the fan I'm going to need a good android phone and I'm not going Samsung,
1132221376750866433,2019-05-25 09:46:26+00:00,"You want to tell me Huawei is bigger that Google? That why I said China has very cheap technology like that of drones,modems,router etc, What about AI revolution by Google? Driverless car, Android AI software libraries, NASA space etc.",
1132221267006971904,2019-05-25 09:46:00+00:00,The Huawei Disaster Reveals Google’s Iron Grip on Android https://onezero.medium.com/the-huawei-disaster-reveals-googles-iron-grip-on-android-b1ccee34504d …,
1132221199700963328,2019-05-25 09:45:44+00:00,"Huawei can’t officially use microSD cards in its phones going forward https://www.theverge.com/2019/5/24/18638539/huawei-microsd-card-sd-association-us-trump-ban … ""The SD Association has confirmed to Android Authority that Huawei’s removal from the group was due to Trump’s executive order.."" international org. & association or USA's?",
1132221181829025792,2019-05-25 09:45:40+00:00,"Huawei Removed From SD Association and Wi-Fi Alliance, Google Removes Its Phones From Android Enterprises Device List pic.twitter.com/vkiprX6s7j",
1132221177542451200,2019-05-25 09:45:39+00:00,"Huawei Removed From SD Association and Wi-Fi Alliance, Google Removes Its Phones From Android Enterprises Device List pic.twitter.com/NZgdLjIS6W",
1132220922704715776,2019-05-25 09:44:38+00:00,Huawei Has Developed Its Own OS By The Name Of Hongmeng To Rival Android https://wonderfulengineering.com/huawei-has-developed-its-own-os-by-the-name-of-hongmeng-to-rival-android/ …,
1132220221022982149,2019-05-25 09:41:50+00:00,Have they not noticed that Google / Android is putting limits on Huawei ? Sure go ahead and buy the phone if you wants a limited version of Android,
1132220149950554112,2019-05-25 09:41:34+00:00,"It will take a massive effort for #Huawei to come back frm this since Google Android, play store & all the apps people use r almost ALL US apps & they can't do business with them any more so making a new version of their OS & the getting people to like it is an uphill task (2/N)",#Huawei
1132219780046262272,2019-05-25 09:40:05+00:00,Huawei working on its own Huawei OS if it loses Android access permanently https://apple.news/Ae4XI3WyBPNu4ERrQOPJkAA …pic.twitter.com/z3ZgQoMqor,
